programStageId,seNumber,dataElementUid,dataElementCode,dhis2DataElementCode,dhis2DataElementName,sortOrder,compulsory,allowProvidedElsewhere,renderType,active
hup8BqEe7Mn,1,TKVyNHVmxcC,1.1.1.1,5-HOSPITAL_1.1.1.1,SURV_HOSP_5-The organisation's governance structure is described in written documents and is known to the staff of the organisation.,1,FALSE,FALSE,DEFAULT,TRUE
hup8BqEe7Mn,1,XQxSlHkb68u,1.1.1.2,7-HOSPITAL_1.1.1.2,SURV_HOSP_7-There is an organisational chart or document that describes the lines of authority and accountability between the governance structure and the organisation as well as within the organisation.,2,FALSE,FALSE,DEFAULT,TRUE
hup8BqEe7Mn,1,jDw4Dg4rBvg,1.1.1.3,9-HOSPITAL_1.1.1.3,SURV_HOSP_9-Those responsible for governance approve and make public the organisation's mission statement.,3,FALSE,FALSE,DEFAULT,TRUE
hup8BqEe7Mn,1,MsJxY5kypsD,1.1.1.4,11-HOSPITAL_1.1.1.4,SURV_HOSP_11-Those responsible for governance approve the managerial policies and plans to operate the organisation.,4,FALSE,FALSE,DEFAULT,TRUE
hup8BqEe7Mn,1,IA3aWk6JklG,1.1.1.5,13-HOSPITAL_1.1.1.5,SURV_HOSP_13-Those responsible for governance approve the budget and allocate resources required to meet the organisation's mission.,5,FALSE,FALSE,DEFAULT,TRUE
hup8BqEe7Mn,1,sWIoPPl3VOW,1.1.1.6,15-HOSPITAL_1.1.1.6,SURV_HOSP_15-Those responsible for governance appoint the organisation's senior manager(s) or director(s).,6,FALSE,FALSE,DEFAULT,TRUE
hup8BqEe7Mn,1,GFGLyyax2ux,1.1.1.7,17-HOSPITAL_1.1.1.7,SURV_HOSP_17-Those responsible for governance collaborate with the organisation's managers.,7,FALSE,FALSE,DEFAULT,TRUE
hup8BqEe7Mn,1,xINAvKnC9fD,1.1.1.8,19-HOSPITAL_1.1.1.8,SURV_HOSP_19-Those responsible for governance receive and act upon reports of the quality programme at least quarterly.,8,FALSE,FALSE,DEFAULT,TRUE
hup8BqEe7Mn,1,uvWd6u7uWJO,1.1.1.9,21-HOSPITAL_1.1.1.9,SURV_HOSP_21-Those responsible for governance receive and act upon reports on risk management at least quarterly.,9,FALSE,FALSE,DEFAULT,TRUE
hup8BqEe7Mn,1,xZsqedkvd70,1.1.1.10,23-HOSPITAL_1.1.1.10,SURV_HOSP_23-Those responsible for governance evaluate the performance of the organisation's senior manager at least annually.,10,FALSE,FALSE,DEFAULT,TRUE
hup8BqEe7Mn,1,se53O2dDOM5,1.2.1.1,28-HOSPITAL_1.2.1.1,"SURV_HOSP_28-The senior manager manages the day-to-day operation of the organisation, including those responsibilities described in the position description.",11,FALSE,FALSE,DEFAULT,TRUE
hup8BqEe7Mn,1,wcMOAttvRRT,1.2.1.2,30-HOSPITAL_1.2.1.2,SURV_HOSP_30-The senior manager has the education and experience to match the requirements in the position description.,12,FALSE,FALSE,DEFAULT,TRUE
hup8BqEe7Mn,1,QognJ4jSAEs,1.2.1.3,32-HOSPITAL_1.2.1.3,SURV_HOSP_32-The senior manager carries out approved policies for management functions.,13,FALSE,FALSE,DEFAULT,TRUE
hup8BqEe7Mn,1,v1FD6k1xm8a,1.2.1.4,34-HOSPITAL_1.2.1.4,SURV_HOSP_34-The senior manager assures compliance with applicable laws and regulations.,14,FALSE,FALSE,DEFAULT,TRUE
hup8BqEe7Mn,1,qGfC5QComL0,1.2.1.5,36-HOSPITAL_1.2.1.5,SURV_HOSP_36-The senior manager responds to any reports from inspecting and regulatory agencies.,15,FALSE,FALSE,DEFAULT,TRUE
hup8BqEe7Mn,1,fGZDNsCGJPi,1.2.2.1,40-HOSPITAL_1.2.2.1,"SURV_HOSP_40-The senior manager facilitates communication and cooperation between the organisation's governance structure, management and the community.",16,FALSE,FALSE,DEFAULT,TRUE
hup8BqEe7Mn,1,iCeFaunWCJu,1.2.2.2,42-HOSPITAL_1.2.2.2,"SURV_HOSP_42-The senior manager implements processes to manage and control human, financial and other resources.",17,FALSE,FALSE,DEFAULT,TRUE
hup8BqEe7Mn,1,SzPo2BqI8ja,1.2.2.3,44-HOSPITAL_1.2.2.3,"SURV_HOSP_44-The senior manager ensures that the required physical facilities, installations and equipment are available and are used optimally to provide the specified services.",18,FALSE,FALSE,DEFAULT,TRUE
hup8BqEe7Mn,1,e6q78Ui0ZJl,1.2.2.4,46-HOSPITAL_1.2.2.4,SURV_HOSP_46-The senior manager ensures the implementation of risk management processes and activities.,19,FALSE,FALSE,DEFAULT,TRUE
hup8BqEe7Mn,1,y3nrsenVUOs,1.2.2.5,48-HOSPITAL_1.2.2.5,SURV_HOSP_48-The senior manager implements processes to monitor patient expectations and satisfaction.,20,FALSE,FALSE,DEFAULT,TRUE
hup8BqEe7Mn,1,JVmIlbQWtAD,1.2.2.6,50-HOSPITAL_1.2.2.6,SURV_HOSP_50-The senior manager implements processes to monitor staff expectations and satisfaction.,21,FALSE,FALSE,DEFAULT,TRUE
hup8BqEe7Mn,1,MkFAUFPTGdn,1.2.2.7,52-HOSPITAL_1.2.2.7,SURV_HOSP_52-The senior manager implements processes for quality management and improvement.,22,FALSE,FALSE,DEFAULT,TRUE
hup8BqEe7Mn,1,NElVlrdybVI,1.2.2.8,54-HOSPITAL_1.2.2.8,SURV_HOSP_54-The senior manager implements processes to monitor the quality of clinical and other services.,23,FALSE,FALSE,DEFAULT,TRUE
hup8BqEe7Mn,1,eMgEJRYkXQo,1.2.3.1,58-HOSPITAL_1.2.3.1,SURV_HOSP_58-The leaders of the organisation are formally identified.,24,FALSE,FALSE,DEFAULT,TRUE
hup8BqEe7Mn,1,yEuSr1wLDCk,1.2.3.2,60-HOSPITAL_1.2.3.2,SURV_HOSP_60-The leaders work collaboratively to develop and implement the strategic plan of the organisation.,25,FALSE,FALSE,DEFAULT,TRUE
hup8BqEe7Mn,1,q7VHWGGK8oZ,1.2.3.3,62-HOSPITAL_1.2.3.3,SURV_HOSP_62-The organisation's leaders meet with the leaders of other provider organisations in their community to develop and revise strategic and operational plans to meet the community needs.,26,FALSE,FALSE,DEFAULT,TRUE
hup8BqEe7Mn,1,IOUYsEJ4job,1.2.4.1,66-HOSPITAL_1.2.4.1,SURV_HOSP_66-The organisation has identified its target population.,27,FALSE,FALSE,DEFAULT,TRUE
hup8BqEe7Mn,1,la3fJDlQ0ed,1.2.4.2,68-HOSPITAL_1.2.4.2,SURV_HOSP_68-The organisation has implemented a communication strategy with these populations.,28,FALSE,FALSE,DEFAULT,TRUE
hup8BqEe7Mn,1,blRZNrnT0xm,1.2.4.3,70-HOSPITAL_1.2.4.3,SURV_HOSP_70-The organisation provides information on the quality of its services.,29,FALSE,FALSE,DEFAULT,TRUE
hup8BqEe7Mn,1,ahi7rmNMlZ8,1.2.5.1,74-HOSPITAL_1.2.5.1,SURV_HOSP_74-The organisation's leaders establish ethical and legal norms that protect patients and their rights.,30,FALSE,FALSE,DEFAULT,TRUE
hup8BqEe7Mn,1,LDWYvqULqBD,1.2.5.2,76-HOSPITAL_1.2.5.2,SURV_HOSP_76-The organisation discloses its ownership.,31,FALSE,FALSE,DEFAULT,TRUE
hup8BqEe7Mn,1,kOzzgEQ0CSr,1.2.5.3,78-HOSPITAL_1.2.5.3,SURV_HOSP_78-The organisation honestly portrays its services to patients.,32,FALSE,FALSE,DEFAULT,TRUE
hup8BqEe7Mn,1,HQ1n3FpRuAf,1.2.5.4,80-HOSPITAL_1.2.5.4,"SURV_HOSP_80-The organisation provides clear admission, treatment, transfer and discharge policies.",33,FALSE,FALSE,DEFAULT,TRUE
hup8BqEe7Mn,1,Nm2vwOAOD9F,1.2.5.5,82-HOSPITAL_1.2.5.5,SURV_HOSP_82-The organisation accurately bills for services.,34,FALSE,FALSE,DEFAULT,TRUE
hup8BqEe7Mn,1,eBrvS1UBpSN,1.2.5.6,84-HOSPITAL_1.2.5.6,SURV_HOSP_84-The organisation has a committee or other mechanism to control all research undertaken within the organisation.,35,FALSE,FALSE,DEFAULT,TRUE
hup8BqEe7Mn,1,tZWbsiQDRj4,1.2.6.1,88-HOSPITAL_1.2.6.1,SURV_HOSP_88-The organisation's leaders ensure that policies and procedures guide and support the activities and management of the organisation.,36,FALSE,FALSE,DEFAULT,TRUE
hup8BqEe7Mn,1,AT19X8lDPyA,1.2.6.2,90-HOSPITAL_1.2.6.2,"SURV_HOSP_90-A designated manager is responsible for compiling and indexing policies and procedures and for ensuring their circulation, recall and review.",37,FALSE,FALSE,DEFAULT,TRUE
hup8BqEe7Mn,1,jPhOxs5biPT,1.2.6.3,92-HOSPITAL_1.2.6.3,SURV_HOSP_92-Policies and procedures are signed by persons authorised to do so.,38,FALSE,FALSE,DEFAULT,TRUE
hup8BqEe7Mn,1,VCQLGPntvoI,1.2.6.4,94-HOSPITAL_1.2.6.4,"SURV_HOSP_94-Policies and procedures are compiled into comprehensive manual(s) or a filing system, which is indexed and easily accessible to all personnel.",39,FALSE,FALSE,DEFAULT,TRUE
hup8BqEe7Mn,1,Td4YVQTR3F6,1.2.6.5,96-HOSPITAL_1.2.6.5,"SURV_HOSP_96-All policies and procedures are reviewed at appropriate intervals, dated and signed.",40,FALSE,FALSE,DEFAULT,TRUE
hup8BqEe7Mn,1,z5p7g8ZksCd,1.2.6.6,98-HOSPITAL_1.2.6.6,SURV_HOSP_98-There is a mechanism to ensure that policies are known and implemented.,41,FALSE,FALSE,DEFAULT,TRUE
hup8BqEe7Mn,1,SWUSzZBSXxf,1.2.7.1,102-HOSPITAL_1.2.7.1,SURV_HOSP_102-Copies of contracts are made available to those who ensure their implementation.,42,FALSE,FALSE,DEFAULT,TRUE
hup8BqEe7Mn,1,TlihTE2hVqk,1.2.7.2,104-HOSPITAL_1.2.7.2,SURV_HOSP_104-Services provided under contracts/agreements meet patient needs.,43,FALSE,FALSE,DEFAULT,TRUE
hup8BqEe7Mn,1,Qwce6rjsYu4,1.2.7.3,106-HOSPITAL_1.2.7.3,SURV_HOSP_106-Contracts and other arrangements are monitored as part of the organisation's quality management and improvement programme.,44,FALSE,FALSE,DEFAULT,TRUE
hup8BqEe7Mn,1,qhEOCXrPsMb,1.2.7.4,108-HOSPITAL_1.2.7.4,SURV_HOSP_108-There is a mechanism to ensure that all volunteers work under the guidance of suitably qualified health professionals in the employ of the care centre.,45,FALSE,FALSE,DEFAULT,TRUE
hup8BqEe7Mn,1,kiIscrPeUcW,1.2.7.5,110-HOSPITAL_1.2.7.5,SURV_HOSP_110-Volunteers sign a memorandum of agreement to abide by the conditions of the centre.,46,FALSE,FALSE,DEFAULT,TRUE
hup8BqEe7Mn,1,jrJQSyy1L3i,1.2.7.6,112-HOSPITAL_1.2.7.6,SURV_HOSP_112-There are written policies and procedures for the activities of the volunteer service.,47,FALSE,FALSE,DEFAULT,TRUE
hup8BqEe7Mn,1,NOQgVpowdpD,1.2.8.1,116-HOSPITAL_1.2.8.1,"SURV_HOSP_116-The organisation's leaders promote communication among departments, services and individual staff members.",48,FALSE,FALSE,DEFAULT,TRUE
hup8BqEe7Mn,1,gvEoFAU39W0,1.2.8.2,118-HOSPITAL_1.2.8.2,"SURV_HOSP_118-Agendas are prepared for meetings, and the personnel are given timely notification in order to prepare for participation.",49,FALSE,FALSE,DEFAULT,TRUE
hup8BqEe7Mn,1,pVg0m9NY8XT,1.2.8.3,120-HOSPITAL_1.2.8.3,SURV_HOSP_120-Minutes of meetings are taken and are circulated to all relevant personnel.,50,FALSE,FALSE,DEFAULT,TRUE
hup8BqEe7Mn,1,FC35WLdWYWw,1.2.8.4,122-HOSPITAL_1.2.8.4,SURV_HOSP_122-There is a mechanism to ensure that key issues resulting from meetings of the governing body and/or the management of the organisation are communicated to and acted upon by the personnel.,51,FALSE,FALSE,DEFAULT,TRUE
hup8BqEe7Mn,1,iDGo1ApSmF9,1.3.1.1,127-HOSPITAL_1.3.1.1,SURV_HOSP_127-The organisation ensures that a qualified individual manages each department or service in the organisation.,52,FALSE,FALSE,DEFAULT,TRUE
hup8BqEe7Mn,1,ZB4FmCbX6pw,1.3.1.2,129-HOSPITAL_1.3.1.2,SURV_HOSP_129-The responsibilities of each departmental manager are defined in writing.,53,FALSE,FALSE,DEFAULT,TRUE
hup8BqEe7Mn,1,MgGxhSPXKlv,1.3.1.3,131-HOSPITAL_1.3.1.3,"SURV_HOSP_131-The departmental or service manager implements processes to manage and control human, financial and other resources.",54,FALSE,FALSE,DEFAULT,TRUE
hup8BqEe7Mn,1,LSZO1jCQv6j,1.3.1.4,133-HOSPITAL_1.3.1.4,SURV_HOSP_133-The departmental or service manager ensures that there are sufficient personnel to provide the services.,55,FALSE,FALSE,DEFAULT,TRUE
hup8BqEe7Mn,1,hGRClQnPima,1.3.1.5,135-HOSPITAL_1.3.1.5,SURV_HOSP_135-The departmental or service manager ensures that resources are available to provide those services.,56,FALSE,FALSE,DEFAULT,TRUE
hup8BqEe7Mn,1,c0kMMRd0YWw,1.3.1.6,137-HOSPITAL_1.3.1.6,SURV_HOSP_137-Departmental or service managers provide orientation and training for all personnel of the department or service appropriate to their responsibilities.,57,FALSE,FALSE,DEFAULT,TRUE
hup8BqEe7Mn,1,kPrcyKc3cH1,1.3.1.7,139-HOSPITAL_1.3.1.7,SURV_HOSP_139-There is coordination and integration of services with other departments and services.,58,FALSE,FALSE,DEFAULT,TRUE
hup8BqEe7Mn,1,MEq7ImWO1k5,1.3.1.8,141-HOSPITAL_1.3.1.8,SURV_HOSP_141-Departmental managers implement quality control and improvement programmes.,59,FALSE,FALSE,DEFAULT,TRUE
hup8BqEe7Mn,1,mcIKw8K4qM6,1.3.2.1,145-HOSPITAL_1.3.2.1,"SURV_HOSP_145-Care planning and delivery is integrated and co-ordinated among care settings, departments and services.",60,FALSE,FALSE,DEFAULT,TRUE
hup8BqEe7Mn,1,wpP1YbT65sT,1.3.2.2,147-HOSPITAL_1.3.2.2,SURV_HOSP_147-Clinical practice guidelines relevant to the patients and services of the organisation are implemented to guide uniform patient care processes.,61,FALSE,FALSE,DEFAULT,TRUE
hup8BqEe7Mn,1,xiFytRaraPt,1.3.2.3,149-HOSPITAL_1.3.2.3,SURV_HOSP_149-The hospital maintains a clinical record for each patient.,62,FALSE,FALSE,DEFAULT,TRUE
hup8BqEe7Mn,1,AxKYDJDcEXD,1.3.2.4,151-HOSPITAL_1.3.2.4,SURV_HOSP_151-The patients' clinical records are completed according to guidelines determined by the organisation.,63,FALSE,FALSE,DEFAULT,TRUE
hup8BqEe7Mn,2,oNuUsjps218,2.1.1.1,157-HOSPITAL_2.1.1.1,SURV_HOSP_157-A designated individual is responsible for providing support for the organisation's human resource strategy.,64,FALSE,FALSE,DEFAULT,TRUE
hup8BqEe7Mn,2,yUYNt7Q8RIh,2.1.1.2,159-HOSPITAL_2.1.1.2,SURV_HOSP_159-The human resource manager is suitably qualified and experienced in human resource management.,65,FALSE,FALSE,DEFAULT,TRUE
hup8BqEe7Mn,2,DKrqw4uAbI5,2.1.1.3,161-HOSPITAL_2.1.1.3,SURV_HOSP_161-The human resource manager ensures that policies and procedures are available to guide the personnel and that they are implemented.,66,FALSE,FALSE,DEFAULT,TRUE
hup8BqEe7Mn,2,VzhCMyqUAwE,2.1.1.4,163-HOSPITAL_2.1.1.4,SURV_HOSP_163-The human resource manager uses information on staffing needs provided by clinical and managerial personnel to ensure adequate staff provision.,67,FALSE,FALSE,DEFAULT,TRUE
hup8BqEe7Mn,2,wqDAeNgBFMR,2.1.1.5,165-HOSPITAL_2.1.1.5,"SURV_HOSP_165-Details of the organisation's absenteeism, sickness rates and staff turnover rates are recorded and analysed, to allow for informed decision making by the management of the organisation.",68,FALSE,FALSE,DEFAULT,TRUE
hup8BqEe7Mn,2,be8YsDAy6ZU,2.1.1.6,167-HOSPITAL_2.1.1.6,"SURV_HOSP_167-Details of the staff establishment (i.e. available posts, filled and vacant posts) are recorded and analysed to allow for informed decision making by the organisation's management.",69,FALSE,FALSE,DEFAULT,TRUE
hup8BqEe7Mn,2,LZo1cXtEeKv,2.1.1.7,169-HOSPITAL_2.1.1.7,"SURV_HOSP_169-Receptionists, telephonists, clerical support personnel and porters are allocated to wards and departments in accordance with their needs.",70,FALSE,FALSE,DEFAULT,TRUE
hup8BqEe7Mn,2,Xg6v8vwv4DQ,2.1.2.1,173-HOSPITAL_2.1.2.1,SURV_HOSP_173-A designated member of staff is responsible for the storage and retrieval of personnel records.,71,FALSE,FALSE,DEFAULT,TRUE
hup8BqEe7Mn,2,sKSR7eQ01OQ,2.1.2.2,175-HOSPITAL_2.1.2.2,SURV_HOSP_175-There is documented personnel information on each staff member.,72,FALSE,FALSE,DEFAULT,TRUE
hup8BqEe7Mn,2,ujU3OxfHU8j,2.1.2.3,177-HOSPITAL_2.1.2.3,SURV_HOSP_177-Personnel files are standardised.,73,FALSE,FALSE,DEFAULT,TRUE
hup8BqEe7Mn,2,L31eBBZ5AT4,2.1.2.4,179-HOSPITAL_2.1.2.4,SURV_HOSP_179-Personnel files are reviewed at least annually.,74,FALSE,FALSE,DEFAULT,TRUE
hup8BqEe7Mn,2,HAkzKddnH9K,2.1.2.5,181-HOSPITAL_2.1.2.5,SURV_HOSP_181-Personnel files contain employment contracts/job description.,75,FALSE,FALSE,DEFAULT,TRUE
hup8BqEe7Mn,2,gXnTHyO0qPO,2.1.2.6,183-HOSPITAL_2.1.2.6,SURV_HOSP_183-Personnel files contain the qualifications of the staff member.,76,FALSE,FALSE,DEFAULT,TRUE
hup8BqEe7Mn,2,OXruMf16WPB,2.1.2.7,185-HOSPITAL_2.1.2.7,SURV_HOSP_185-Personnel files contain details of staff evaluations.,77,FALSE,FALSE,DEFAULT,TRUE
hup8BqEe7Mn,2,Hved3gLJv0U,2.1.2.8,187-HOSPITAL_2.1.2.8,SURV_HOSP_187-Personnel files contain the work history of the staff member.,78,FALSE,FALSE,DEFAULT,TRUE
hup8BqEe7Mn,2,QnMOvwwuySY,2.1.2.9,189-HOSPITAL_2.1.2.9,SURV_HOSP_189-Personnel files contain a record of in-service education attended by the staff member.,79,FALSE,FALSE,DEFAULT,TRUE
hup8BqEe7Mn,2,uRJrlyLLbkw,2.1.2.10,191-HOSPITAL_2.1.2.10,SURV_HOSP_191-Only authorised persons have access to personnel records.,80,FALSE,FALSE,DEFAULT,TRUE
hup8BqEe7Mn,2,I9htiRxsVKm,2.2.1.1,196-HOSPITAL_2.2.1.1,SURV_HOSP_196-There are documented processes for staffing the organisation.,81,FALSE,FALSE,DEFAULT,TRUE
hup8BqEe7Mn,2,dvza0wvk2G7,2.2.1.2,198-HOSPITAL_2.2.1.2,SURV_HOSP_198-The processes include personnel recruitment.,82,FALSE,FALSE,DEFAULT,TRUE
hup8BqEe7Mn,2,N7TzpqNzt5c,2.2.1.3,200-HOSPITAL_2.2.1.3,SURV_HOSP_200-The processes include numbers and categories of personnel required.,83,FALSE,FALSE,DEFAULT,TRUE
hup8BqEe7Mn,2,EN1WJXRuO5Y,2.2.1.4,202-HOSPITAL_2.2.1.4,"SURV_HOSP_202-The processes include desired education, qualifications, skills and knowledge of required personnel.",84,FALSE,FALSE,DEFAULT,TRUE
hup8BqEe7Mn,2,otCzrpm35kU,2.2.1.5,204-HOSPITAL_2.2.1.5,SURV_HOSP_204-The processes include assignment and reassignment of personnel.,85,FALSE,FALSE,DEFAULT,TRUE
hup8BqEe7Mn,2,STQiDvgmq6n,2.2.1.6,206-HOSPITAL_2.2.1.6,SURV_HOSP_206-The processes include personal development of the personnel.,86,FALSE,FALSE,DEFAULT,TRUE
hup8BqEe7Mn,2,G3nxa8r1ZFW,2.2.1.7,208-HOSPITAL_2.2.1.7,SURV_HOSP_208-The processes include staff retention.,87,FALSE,FALSE,DEFAULT,TRUE
hup8BqEe7Mn,2,jT9rP4uAP0F,2.3.1.1,213-HOSPITAL_2.3.1.1,"SURV_HOSP_213-Personnel employed by the organisation have written job descriptions and performance agreements, which define their responsibilities.",88,FALSE,FALSE,DEFAULT,TRUE
hup8BqEe7Mn,2,JEVVOfbVMF1,2.3.1.2,215-HOSPITAL_2.3.1.2,SURV_HOSP_215-Job descriptions and performance agreements are reviewed according to organisational policy.,89,FALSE,FALSE,DEFAULT,TRUE
hup8BqEe7Mn,2,GYJDSrsUCSR,2.3.1.3,217-HOSPITAL_2.3.1.3,SURV_HOSP_217-Each staff member accepts their job description and performance agreement by signing it.,90,FALSE,FALSE,DEFAULT,TRUE
hup8BqEe7Mn,2,i5uWz1LoXnH,2.3.2.1,221-HOSPITAL_2.3.2.1,SURV_HOSP_221-Key performance areas for each staff member are identified in their job descriptions and performance agreements.,91,FALSE,FALSE,DEFAULT,TRUE
hup8BqEe7Mn,2,lOI96Ar9eej,2.3.2.2,223-HOSPITAL_2.3.2.2,SURV_HOSP_223-There is at least one documented evaluation of each staff member each year or more frequently as defined by organisational policy.,92,FALSE,FALSE,DEFAULT,TRUE
hup8BqEe7Mn,2,gxjndbZ7FD2,2.3.2.3,225-HOSPITAL_2.3.2.3,SURV_HOSP_225-New staff members are evaluated as defined by organisational policy.,93,FALSE,FALSE,DEFAULT,TRUE
hup8BqEe7Mn,2,QMaJxSBs5na,2.3.3.1,229-HOSPITAL_2.3.3.1,SURV_HOSP_229-Designated personnel are educated/trained in labour law legislation and related processes.,94,FALSE,FALSE,DEFAULT,TRUE
hup8BqEe7Mn,2,iFhbey92NXM,2.3.3.2,231-HOSPITAL_2.3.3.2,"SURV_HOSP_231-There are mutually agreed processes for the satisfactory conduct of industrial relations activities, which meet the requirements of current legislation.",95,FALSE,FALSE,DEFAULT,TRUE
hup8BqEe7Mn,2,bijn5mjKJbG,2.3.3.3,233-HOSPITAL_2.3.3.3,SURV_HOSP_233-Disciplinary procedures are implemented.,96,FALSE,FALSE,DEFAULT,TRUE
hup8BqEe7Mn,2,Sdts6QesCcf,2.3.3.4,235-HOSPITAL_2.3.3.4,SURV_HOSP_235-Grievance procedures are implemented.,97,FALSE,FALSE,DEFAULT,TRUE
hup8BqEe7Mn,2,EEkiLyJDauJ,2.3.3.5,237-HOSPITAL_2.3.3.5,SURV_HOSP_237-Dispute and appeal procedures are implemented.,98,FALSE,FALSE,DEFAULT,TRUE
hup8BqEe7Mn,2,sFcvV6zWDSb,2.3.3.6,239-HOSPITAL_2.3.3.6,"SURV_HOSP_239-There are recognition agreements with trade unions and/or health professional organisations, where applicable.",99,FALSE,FALSE,DEFAULT,TRUE
hup8BqEe7Mn,2,vbAleNgnhI9,2.4.1.1,244-HOSPITAL_2.4.1.1,SURV_HOSP_244-There are documented programmes for staff orientation to the organisation.,100,FALSE,FALSE,DEFAULT,TRUE
hup8BqEe7Mn,2,NFgywTdUau5,2.4.1.2,246-HOSPITAL_2.4.1.2,SURV_HOSP_246-New staff members are orientated to the organisation within a time frame determined by organisational policy.,101,FALSE,FALSE,DEFAULT,TRUE
hup8BqEe7Mn,2,A2jYYzEDlbT,2.4.1.3,248-HOSPITAL_2.4.1.3,SURV_HOSP_248-Departmental and service managers implement orientation programmes for departmental and service personnel.,102,FALSE,FALSE,DEFAULT,TRUE
hup8BqEe7Mn,2,H9PgLhMCLS1,2.4.1.4,250-HOSPITAL_2.4.1.4,"SURV_HOSP_250-Contract workers and/or volunteers are orientated to the organisation, their job responsibilities and their specific assignments.",103,FALSE,FALSE,DEFAULT,TRUE
hup8BqEe7Mn,2,ASb3dV3s7rc,2.4.2.1,254-HOSPITAL_2.4.2.1,SURV_HOSP_254-The organisation has a coordinated plan for in-service training and development.,104,FALSE,FALSE,DEFAULT,TRUE
hup8BqEe7Mn,2,ROakd7GygvW,2.4.2.2,256-HOSPITAL_2.4.2.2,SURV_HOSP_256-Department and service managers have established in-service training and development programmes relevant to departmental and service personnel.,105,FALSE,FALSE,DEFAULT,TRUE
hup8BqEe7Mn,2,Ij5EQlihjZI,2.4.2.3,258-HOSPITAL_2.4.2.3,SURV_HOSP_258-The organisation uses various sources of data and information to identify the in-service training and development needs of the personnel.,106,FALSE,FALSE,DEFAULT,TRUE
hup8BqEe7Mn,2,wc8LqUdex1s,2.4.2.4,260-HOSPITAL_2.4.2.4,SURV_HOSP_260-The organisation provides on-going in-service training and development for its personnel.,107,FALSE,FALSE,DEFAULT,TRUE
hup8BqEe7Mn,2,uJ8D7rnFI1l,2.4.2.5,262-HOSPITAL_2.4.2.5,"SURV_HOSP_262-Staff competencies, where relevant, are assessed and recorded after in-service training and development.",108,FALSE,FALSE,DEFAULT,TRUE
hup8BqEe7Mn,2,pjyWawxeHlG,2.4.3.1,266-HOSPITAL_2.4.3.1,SURV_HOSP_266-There is a continuing educational strategy developed by the management of the organisation for all professional personnel in the organisation to fulfil the requirements for continued registration with the relevant pr,109,FALSE,FALSE,DEFAULT,TRUE
hup8BqEe7Mn,2,T6xARZbYdtX,2.4.3.2,268-HOSPITAL_2.4.3.2,SURV_HOSP_268-There is a development strategy for the organisation to ensure that managers receive the training required to fulfil their responsibilities.,110,FALSE,FALSE,DEFAULT,TRUE
hup8BqEe7Mn,2,bW6TupSiLXl,2.4.3.3,270-HOSPITAL_2.4.3.3,"SURV_HOSP_270-The personnel are informed of opportunities to participate in advanced education, training, research and other experiences.",111,FALSE,FALSE,DEFAULT,TRUE
hup8BqEe7Mn,2,O5c8A3gibnk,2.4.3.4,272-HOSPITAL_2.4.3.4,SURV_HOSP_272-The organisation supports staff participation in such opportunities.,112,FALSE,FALSE,DEFAULT,TRUE
hup8BqEe7Mn,2,ZBahGuy1Mp8,2.4.3.5,274-HOSPITAL_2.4.3.5,SURV_HOSP_274-The organisation supports the need for relevant postgraduate qualifications.,113,FALSE,FALSE,DEFAULT,TRUE
hup8BqEe7Mn,2,QAqCz7JrqNC,2.5.1.1,279-HOSPITAL_2.5.1.1,"SURV_HOSP_279-Those permitted by law, regulation and the organisation to provide patient care without supervision are identified.",114,FALSE,FALSE,DEFAULT,TRUE
hup8BqEe7Mn,2,B08Ff1HtD9X,2.5.1.2,281-HOSPITAL_2.5.1.2,"SURV_HOSP_281-The registration, education, training and experience of these individuals are documented.",115,FALSE,FALSE,DEFAULT,TRUE
hup8BqEe7Mn,2,nlGhZ5Hctyn,2.5.1.3,283-HOSPITAL_2.5.1.3,SURV_HOSP_283-Such information is verified from the original sources.,116,FALSE,FALSE,DEFAULT,TRUE
hup8BqEe7Mn,2,mO8u4oDrgC0,2.5.1.4,285-HOSPITAL_2.5.1.4,SURV_HOSP_285-The personnel record contains copies of any required registration certificate(s).,117,FALSE,FALSE,DEFAULT,TRUE
hup8BqEe7Mn,2,JsXWJotjtzp,2.5.1.5,287-HOSPITAL_2.5.1.5,SURV_HOSP_287-There is a process to review the personnel records annually.,118,FALSE,FALSE,DEFAULT,TRUE
hup8BqEe7Mn,2,OxhrzvNlwTP,2.5.1.6,289-HOSPITAL_2.5.1.6,"SURV_HOSP_289-The organisation has a process to ensure that nurses and other professionals who are not employees of the organisation, but provide services to the organisation's patients, have valid credentials.",119,FALSE,FALSE,DEFAULT,TRUE
hup8BqEe7Mn,2,Lkknjnht4IO,2.5.1.7,291-HOSPITAL_2.5.1.7,SURV_HOSP_291-The services to be provided are made known to appropriate individuals and units of the organisation.,120,FALSE,FALSE,DEFAULT,TRUE
hup8BqEe7Mn,2,ct1BKz5HTcJ,2.6.1.1,296-HOSPITAL_2.6.1.1,SURV_HOSP_296-There are formalised quality improvement processes for the service that have been developed and agreed upon by the personnel of the service.,121,FALSE,FALSE,DEFAULT,TRUE
hup8BqEe7Mn,2,b2GiTPhm50o,2.6.1.2,298-HOSPITAL_2.6.1.2,SURV_HOSP_298-Indicators of performance are identified to evaluate the quality of the service.,122,FALSE,FALSE,DEFAULT,TRUE
hup8BqEe7Mn,2,jTzkc0SOpbR,2.6.1.3,300-HOSPITAL_2.6.1.3,SURV_HOSP_300-The quality improvement cycle includes the monitoring and evaluation of the standards set and the remedial action implemented.,123,FALSE,FALSE,DEFAULT,TRUE
hup8BqEe7Mn,2,e35PcQMBJtQ,2.6.1.4,302-HOSPITAL_2.6.1.4,SURV_HOSP_302-The performance of individual staff members is reviewed when indicated by the findings of quality improvement activities.,124,FALSE,FALSE,DEFAULT,TRUE
hup8BqEe7Mn,2,PAfpCyxBnV6,2.6.1.5,304-HOSPITAL_2.6.1.5,"SURV_HOSP_304-The performance of individual staff members is reviewed periodically, as established by the organisation.",125,FALSE,FALSE,DEFAULT,TRUE
hup8BqEe7Mn,3,Ztft32SpjNj,3.1.1.1,310-HOSPITAL_3.1.1.1,SURV_HOSP_310-A designated financial manager is responsible for the implementation and maintenance of the financial strategy.,126,FALSE,FALSE,DEFAULT,TRUE
hup8BqEe7Mn,3,G7efpHH4mb0,3.1.1.2,312-HOSPITAL_3.1.1.2,SURV_HOSP_312-The financial manager ensures that policies and procedures are available to guide the staff and that they are implemented.,127,FALSE,FALSE,DEFAULT,TRUE
hup8BqEe7Mn,3,jviWXgBiV4Q,3.1.1.3,314-HOSPITAL_3.1.1.3,SURV_HOSP_314-There is a mechanism for allowing the personnel to participate in the development and management of budgets (e.g. cost centres).,128,FALSE,FALSE,DEFAULT,TRUE
hup8BqEe7Mn,3,muGAwFBlSwh,3.1.1.4,316-HOSPITAL_3.1.1.4,"SURV_HOSP_316-A monthly report is produced for the organisation's management, setting out the financial position to date.",129,FALSE,FALSE,DEFAULT,TRUE
hup8BqEe7Mn,3,IVMSCBlO0xe,3.1.1.5,318-HOSPITAL_3.1.1.5,SURV_HOSP_318-There is a mechanism for establishing the reason for budget variation in either income or expenditure.,130,FALSE,FALSE,DEFAULT,TRUE
hup8BqEe7Mn,3,Sakk4c7kA6w,3.1.1.6,320-HOSPITAL_3.1.1.6,SURV_HOSP_320-Annual financial statements are produced at the end of the financial year.,131,FALSE,FALSE,DEFAULT,TRUE
