programStageId,seNumber,dataElementUid,dataElementCode,dhis2DataElementCode,dhis2DataElementName,sortOrder,compulsory,allowProvidedElsewhere,renderType,active
hup8BqEe7Mn,22,nCiepz41oQV,22.1.1.6,4228-HOSPITAL_22.1.1.6,"SURV_HOSP_4228-Medical cover is reflected on a roster and each practitioner on the roster is contactable by telephone or pager, or other two-way communication method.",1669,FALSE,FALSE,DEFAULT,TRUE
hup8BqEe7Mn,22,CV6DZxgwg4c,22.1.2.1,4232-HOSPITAL_22.1.2.1,SURV_HOSP_4232-The patient's clinical records are completed according to guidelines determined by the organisation.,1670,FALSE,FALSE,DEFAULT,TRUE
hup8BqEe7Mn,22,hvQsTFquLx0,22.1.2.2,4234-HOSPITAL_22.1.2.2,SURV_HOSP_4234-The patient's records are up to date to ensure the transfer of the latest information between care providers.,1671,FALSE,FALSE,DEFAULT,TRUE
hup8BqEe7Mn,22,A2NEirZDqLY,22.1.2.3,4236-HOSPITAL_22.1.2.3,SURV_HOSP_4236-Information exchanged includes a summary of the care provided.,1672,FALSE,FALSE,DEFAULT,TRUE
hup8BqEe7Mn,22,LlEReUioGru,22.1.2.4,4238-HOSPITAL_22.1.2.4,SURV_HOSP_4238-Information exchanged includes the patient's progress.,1673,FALSE,FALSE,DEFAULT,TRUE
hup8BqEe7Mn,22,vMH3WrbQtJo,22.1.2.5,4240-HOSPITAL_22.1.2.5,SURV_HOSP_4240-The author can be identified for each patient record entry.,1674,FALSE,FALSE,DEFAULT,TRUE
hup8BqEe7Mn,22,XGrkGIcLdML,22.1.2.6,4242-HOSPITAL_22.1.2.6,SURV_HOSP_4242-The date of each patient record entry can be identified.,1675,FALSE,FALSE,DEFAULT,TRUE
hup8BqEe7Mn,22,LuqpqqsUBzj,22.1.2.7,4244-HOSPITAL_22.1.2.7,SURV_HOSP_4244-The time of each patient record entry can be identified.,1676,FALSE,FALSE,DEFAULT,TRUE
hup8BqEe7Mn,22,voFEFcUflRw,22.2.1.1,4249-HOSPITAL_22.2.1.1,SURV_HOSP_4249-Patient and staff accommodation in the service is adequate to meet patient care needs.,1677,FALSE,FALSE,DEFAULT,TRUE
hup8BqEe7Mn,22,aaSrHqZSHeL,22.2.1.2,4251-HOSPITAL_22.2.1.2,SURV_HOSP_4251-Facilities allow privacy when providing personal information or undergoing examination or procedures.,1678,FALSE,FALSE,DEFAULT,TRUE
hup8BqEe7Mn,22,zvobH0BOBlt,22.2.1.3,4253-HOSPITAL_22.2.1.3,SURV_HOSP_4253-Electricity and water is available in accordance with the policies of the organisation.,1679,FALSE,FALSE,DEFAULT,TRUE
hup8BqEe7Mn,22,NKS3r5vCwjN,22.2.1.4,4255-HOSPITAL_22.2.1.4,SURV_HOSP_4255-There is a waiting area for patients and families.,1680,FALSE,FALSE,DEFAULT,TRUE
hup8BqEe7Mn,22,pW7zgkhr5FV,22.2.1.5,4257-HOSPITAL_22.2.1.5,SURV_HOSP_4257-There is adequate seating in the waiting area.,1681,FALSE,FALSE,DEFAULT,TRUE
hup8BqEe7Mn,22,RfRwFr3Omu1,22.2.1.6,4259-HOSPITAL_22.2.1.6,SURV_HOSP_4259-Wheelchair-accessible toilets are available.,1682,FALSE,FALSE,DEFAULT,TRUE
hup8BqEe7Mn,22,eLEZfSBplyV,22.2.1.7,4261-HOSPITAL_22.2.1.7,SURV_HOSP_4261-Quiet and private areas are available for waiting relatives and grieving or otherwise distressed relatives or carers.,1683,FALSE,FALSE,DEFAULT,TRUE
hup8BqEe7Mn,22,IqWFLE6Fmsv,22.2.1.8,4263-HOSPITAL_22.2.1.8,SURV_HOSP_4263-There is access to a functioning telephone facility for use by the public.,1684,FALSE,FALSE,DEFAULT,TRUE
hup8BqEe7Mn,22,VFEI5WpLzgT,22.2.2.1,4267-HOSPITAL_22.2.2.1,SURV_HOSP_4267-There is a designated triage area.,1685,FALSE,FALSE,DEFAULT,TRUE
hup8BqEe7Mn,22,GzHIQT6fXzf,22.2.2.2,4269-HOSPITAL_22.2.2.2,SURV_HOSP_4269-There is a designated resuscitation area.,1686,FALSE,FALSE,DEFAULT,TRUE
hup8BqEe7Mn,22,Aaxh7kMrRTS,22.2.2.3,4271-HOSPITAL_22.2.2.3,SURV_HOSP_4271-There is a mechanism for the summoning of medical help in an emergency.,1687,FALSE,FALSE,DEFAULT,TRUE
hup8BqEe7Mn,22,VgbJ8WqYy4P,22.2.2.4,4273-HOSPITAL_22.2.2.4,SURV_HOSP_4273-Oxygen and vacuum supplies meet patient care needs.,1688,FALSE,FALSE,DEFAULT,TRUE
hup8BqEe7Mn,22,aMmFFCr3XRu,22.2.2.5,4275-HOSPITAL_22.2.2.5,"SURV_HOSP_4275-Where there are no piped oxygen installations, there is a documented procedure for ensuring that cylinder pressures (i.e. contents) are monitored according to organisational policy while patients are receiving oxyge",1689,FALSE,FALSE,DEFAULT,TRUE
hup8BqEe7Mn,22,mWfp3gqrINh,22.2.2.6,4277-HOSPITAL_22.2.2.6,SURV_HOSP_4277-There is adequate storage space to enable rapid retrieval and removal of equipment when needed.,1690,FALSE,FALSE,DEFAULT,TRUE
hup8BqEe7Mn,22,LMMRVVUaa7I,22.2.2.7,4279-HOSPITAL_22.2.2.7,SURV_HOSP_4279-There is evidence that equipment is maintained in accordance with the policies of the organisation.,1691,FALSE,FALSE,DEFAULT,TRUE
hup8BqEe7Mn,22,kjmDOtogQ91,22.2.2.8,4281-HOSPITAL_22.2.2.8,SURV_HOSP_4281-Each patient has access to a nurse call system at all times.,1692,FALSE,FALSE,DEFAULT,TRUE
hup8BqEe7Mn,22,y2449LoqSBV,22.2.2.9,4283-HOSPITAL_22.2.2.9,"SURV_HOSP_4283-There is a low pressure, hand-held shower suitable for the management of patients contaminated with hazardous materials.",1693,FALSE,FALSE,DEFAULT,TRUE
hup8BqEe7Mn,22,skZGVVyK9Yq,22.2.2.10,4285-HOSPITAL_22.2.2.10,SURV_HOSP_4285-There is access to inpatient facilities consistent with the level of emergency care.,1694,FALSE,FALSE,DEFAULT,TRUE
hup8BqEe7Mn,22,B0tj7RDaXJ6,22.2.2.11,4287-HOSPITAL_22.2.2.11,SURV_HOSP_4287-There is easy access to the operating theatre.,1695,FALSE,FALSE,DEFAULT,TRUE
hup8BqEe7Mn,22,QnUKwGQhB6l,22.2.3.1,4291-HOSPITAL_22.2.3.1,SURV_HOSP_4291-Resuscitation equipment is available in accordance with the policies of the organisation.,1696,FALSE,FALSE,DEFAULT,TRUE
hup8BqEe7Mn,22,Uu5wnZwu0RJ,22.2.3.2,4293-HOSPITAL_22.2.3.2,SURV_HOSP_4293-Recommended appliances are available for specialised resuscitations.,1697,FALSE,FALSE,DEFAULT,TRUE
hup8BqEe7Mn,22,ugJoEQLnDKB,22.2.3.3,4295-HOSPITAL_22.2.3.3,SURV_HOSP_4295-Diagnostic and vital signs monitoring equipment is available as per organisational policy.,1698,FALSE,FALSE,DEFAULT,TRUE
hup8BqEe7Mn,22,Ewvnv39dA1e,22.2.4.1,4299-HOSPITAL_22.2.4.1,"SURV_HOSP_4299-There is an adequately equipped kitchen, with at least a kettle, toaster and microwave.",1699,FALSE,FALSE,DEFAULT,TRUE
hup8BqEe7Mn,22,b6w6ufr71tI,22.2.4.2,4301-HOSPITAL_22.2.4.2,"SURV_HOSP_4301-There are rest room facilities for personnel including a changing area, toilet and hand-washing facilities.",1700,FALSE,FALSE,DEFAULT,TRUE
hup8BqEe7Mn,22,Er3u1n0FKTi,22.2.4.3,4303-HOSPITAL_22.2.4.3,"SURV_HOSP_4303-Where personnel undertake 24 hour shifts, there are sleeping and shower facilities.",1701,FALSE,FALSE,DEFAULT,TRUE
hup8BqEe7Mn,22,HaoiLH48JYz,22.2.4.4,4305-HOSPITAL_22.2.4.4,SURV_HOSP_4305-The rest area is equipped with a telephone or intercom system.,1702,FALSE,FALSE,DEFAULT,TRUE
hup8BqEe7Mn,22,teXZ6XIspJ2,22.3.1.1,4310-HOSPITAL_22.3.1.1,SURV_HOSP_4310-The organisation's policy on visitors to the emergency unit is implemented.,1703,FALSE,FALSE,DEFAULT,TRUE
hup8BqEe7Mn,22,sCTyqcLznDl,22.3.1.2,4312-HOSPITAL_22.3.1.2,SURV_HOSP_4312-There is a system to inform patients and family of the visitors' policy.,1704,FALSE,FALSE,DEFAULT,TRUE
hup8BqEe7Mn,22,CqC8M0Ee350,22.3.1.3,4314-HOSPITAL_22.3.1.3,SURV_HOSP_4314-Areas where access is denied to persons other than staff members are clearly marked.,1705,FALSE,FALSE,DEFAULT,TRUE
hup8BqEe7Mn,22,Ap6P7dWcBfG,22.3.1.4,4316-HOSPITAL_22.3.1.4,SURV_HOSP_4316-The discretionary powers of the personnel in charge of the service relating to visitors under special circumstances are documented.,1706,FALSE,FALSE,DEFAULT,TRUE
hup8BqEe7Mn,22,balxCoSaxAZ,22.3.1.5,4318-HOSPITAL_22.3.1.5,SURV_HOSP_4318-Policies regarding media invasion are implemented to guide clinical and security personnel.,1707,FALSE,FALSE,DEFAULT,TRUE
hup8BqEe7Mn,22,eFLh10iNs4r,22.4.1.1,4323-HOSPITAL_22.4.1.1,SURV_HOSP_4323-A register is kept of patients attending the emergency unit.,1708,FALSE,FALSE,DEFAULT,TRUE
hup8BqEe7Mn,22,buyHjkv1J4w,22.4.1.2,4325-HOSPITAL_22.4.1.2,"SURV_HOSP_4325-The register contains at least the patient's name, patient-specific identification number, age, gender, date and time of admission, treatment, procedures, discharge, referral or death.",1709,FALSE,FALSE,DEFAULT,TRUE
hup8BqEe7Mn,22,GtiLyDugDYM,22.4.1.3,4327-HOSPITAL_22.4.1.3,SURV_HOSP_4327-The information in the register is used to monitor waiting periods from time of arrival to time of assessment.,1710,FALSE,FALSE,DEFAULT,TRUE
hup8BqEe7Mn,22,xom1wHZNVsL,22.5.1.1,4332-HOSPITAL_22.5.1.1,SURV_HOSP_4332-Clinical practice guidelines relevant to the patients and services of the organisation are available to guide patient care processes.,1711,FALSE,FALSE,DEFAULT,TRUE
hup8BqEe7Mn,22,t1Ag5HGjQnu,22.5.1.2,4334-HOSPITAL_22.5.1.2,SURV_HOSP_4334-Clinical practice guidelines include protocols for time-critical states.,1712,FALSE,FALSE,DEFAULT,TRUE
hup8BqEe7Mn,22,fqk2YfPsIdI,22.5.1.3,4336-HOSPITAL_22.5.1.3,SURV_HOSP_4336-The implementation of guidelines is monitored as part of a structured clinical audit.,1713,FALSE,FALSE,DEFAULT,TRUE
hup8BqEe7Mn,22,Ru2CkwMPMGs,22.5.1.4,4338-HOSPITAL_22.5.1.4,SURV_HOSP_4338-Guidelines are reviewed and adapted on a regular basis.,1714,FALSE,FALSE,DEFAULT,TRUE
hup8BqEe7Mn,22,PC0VxWcrlNB,22.6.1.1,4343-HOSPITAL_22.6.1.1,SURV_HOSP_4343-Clinical records of emergency patients include the time of arrival.,1715,FALSE,FALSE,DEFAULT,TRUE
hup8BqEe7Mn,22,rOn61FAjqoN,22.6.1.2,4345-HOSPITAL_22.6.1.2,SURV_HOSP_4345-The triage category for each patient is recorded.,1716,FALSE,FALSE,DEFAULT,TRUE
hup8BqEe7Mn,22,cYCTobhzuNm,22.6.1.3,4347-HOSPITAL_22.6.1.3,SURV_HOSP_4347-Clinical records of emergency patients include time of referral to medical practitioner.,1717,FALSE,FALSE,DEFAULT,TRUE
hup8BqEe7Mn,22,ouHIYiVWaM8,22.6.1.4,4349-HOSPITAL_22.6.1.4,SURV_HOSP_4349-Waiting times from triage categorisation to initial assessment are monitored.,1718,FALSE,FALSE,DEFAULT,TRUE
hup8BqEe7Mn,22,wrU6kdeQAHm,22.6.2.1,4353-HOSPITAL_22.6.2.1,SURV_HOSP_4353-The organisation implements policies and procedures for assessing patients on admission and during on-going care.,1719,FALSE,FALSE,DEFAULT,TRUE
hup8BqEe7Mn,22,U6vttPppV1F,22.6.2.2,4355-HOSPITAL_22.6.2.2,SURV_HOSP_4355-Only those individuals permitted by applicable laws and regulations or by registration and appropriate training/experience perform the assessments.,1720,FALSE,FALSE,DEFAULT,TRUE
hup8BqEe7Mn,22,nLcKt5J7U3C,22.6.2.3,4357-HOSPITAL_22.6.2.3,SURV_HOSP_4357-The scope and content of assessment by each discipline is defined.,1721,FALSE,FALSE,DEFAULT,TRUE
hup8BqEe7Mn,22,nCFSXzjCbHh,22.6.2.4,4359-HOSPITAL_22.6.2.4,SURV_HOSP_4359-Assessment findings are documented in the patient's clinical record and are readily available to those responsible for the patient's care.,1722,FALSE,FALSE,DEFAULT,TRUE
hup8BqEe7Mn,22,mRgStz7cp5o,22.7.1.1,4364-HOSPITAL_22.7.1.1,SURV_HOSP_4364-Adequate and convenient diagnostic imaging services are available at all times.,1723,FALSE,FALSE,DEFAULT,TRUE
hup8BqEe7Mn,22,oNGBbELA1Q3,22.7.1.2,4366-HOSPITAL_22.7.1.2,"SURV_HOSP_4366-Established waiting times for diagnostic imaging studies to be done, according to triage status, are monitored.",1724,FALSE,FALSE,DEFAULT,TRUE
hup8BqEe7Mn,22,XoEyvbQadcQ,22.7.1.3,4368-HOSPITAL_22.7.1.3,SURV_HOSP_4368-Established waiting times for diagnostic images to be available are monitored.,1725,FALSE,FALSE,DEFAULT,TRUE
hup8BqEe7Mn,22,YGSAvyjtO7j,22.7.1.4,4370-HOSPITAL_22.7.1.4,"SURV_HOSP_4370-Where X-rays are initially read by emergency unit medical personnel, there is a clearly defined system for review by appropriately qualified diagnostic imaging personnel, when required.",1726,FALSE,FALSE,DEFAULT,TRUE
hup8BqEe7Mn,22,IN4A4yfr8eo,22.7.2.1,4374-HOSPITAL_22.7.2.1,SURV_HOSP_4374-Laboratory services are available at all times.,1727,FALSE,FALSE,DEFAULT,TRUE
hup8BqEe7Mn,22,v0lVNGoZRaz,22.7.2.2,4376-HOSPITAL_22.7.2.2,"SURV_HOSP_4376-Established waiting times for laboratory tests to be done, according to triage status, are monitored.",1728,FALSE,FALSE,DEFAULT,TRUE
hup8BqEe7Mn,22,rv3lILCZAcW,22.7.2.3,4378-HOSPITAL_22.7.2.3,SURV_HOSP_4378-Established waiting times for laboratory results to be available are monitored.,1729,FALSE,FALSE,DEFAULT,TRUE
hup8BqEe7Mn,22,qpOkrTgl5s2,22.8.1.1,4383-HOSPITAL_22.8.1.1,SURV_HOSP_4383-There is a documented process for obtaining informed consent.,1730,FALSE,FALSE,DEFAULT,TRUE
hup8BqEe7Mn,22,IKrnQW3IdT8,22.8.1.2,4385-HOSPITAL_22.8.1.2,SURV_HOSP_4385-Patients are informed about their condition and the proposed treatment.,1731,FALSE,FALSE,DEFAULT,TRUE
hup8BqEe7Mn,22,K8SXMEEkaoC,22.8.1.3,4387-HOSPITAL_22.8.1.3,SURV_HOSP_4387-Patients know the identity of the medical practitioner or other professional practitioner responsible for their care.,1732,FALSE,FALSE,DEFAULT,TRUE
hup8BqEe7Mn,22,aeW6j6mQa58,22.8.1.4,4389-HOSPITAL_22.8.1.4,SURV_HOSP_4389-The information provided is recorded with the record of the patient having provided written or verbal consent.,1733,FALSE,FALSE,DEFAULT,TRUE
hup8BqEe7Mn,22,xwQ329zpd6t,22.8.2.1,4393-HOSPITAL_22.8.2.1,"SURV_HOSP_4393-Protocols guide medication use for sedation, pain and anaesthesia.",1734,FALSE,FALSE,DEFAULT,TRUE
hup8BqEe7Mn,22,DvaPZBJg90w,22.8.2.2,4395-HOSPITAL_22.8.2.2,SURV_HOSP_4395-Protocols address appropriate monitoring during and after the procedure.,1735,FALSE,FALSE,DEFAULT,TRUE
hup8BqEe7Mn,22,ZL12J3kdrFG,22.8.2.3,4397-HOSPITAL_22.8.2.3,SURV_HOSP_4397-The procedure and the name of the person performing the procedure are recorded in the patient's record.,1736,FALSE,FALSE,DEFAULT,TRUE
hup8BqEe7Mn,22,mTFDTO6PJfc,22.8.2.4,4399-HOSPITAL_22.8.2.4,SURV_HOSP_4399-Unsuccessful or complicated procedures are recorded.,1737,FALSE,FALSE,DEFAULT,TRUE
hup8BqEe7Mn,22,oYzcqdTw8Nq,22.8.3.1,4403-HOSPITAL_22.8.3.1,SURV_HOSP_4403-The indication for surgery is recorded before anaesthesia.,1738,FALSE,FALSE,DEFAULT,TRUE
hup8BqEe7Mn,22,x4oe4eRIlfa,22.8.3.2,4405-HOSPITAL_22.8.3.2,SURV_HOSP_4405-Policies that address nursing preparation of patients being transferred to the operating theatre are implemented.,1739,FALSE,FALSE,DEFAULT,TRUE
hup8BqEe7Mn,22,xcoVCO7WLvA,22.8.3.3,4407-HOSPITAL_22.8.3.3,"SURV_HOSP_4407-Patients being transferred to the operating room are accompanied by an appropriately qualified person, as determined by organisation policy.",1740,FALSE,FALSE,DEFAULT,TRUE
hup8BqEe7Mn,22,W92CqPQL5Dt,22.8.4.1,4411-HOSPITAL_22.8.4.1,SURV_HOSP_4411-A post-operative diagnosis is documented.,1741,FALSE,FALSE,DEFAULT,TRUE
hup8BqEe7Mn,22,R7uy2kmLPTH,22.8.4.2,4413-HOSPITAL_22.8.4.2,SURV_HOSP_4413-The name of the medical practitioner and the names of other personnel as required by law are documented.,1742,FALSE,FALSE,DEFAULT,TRUE
hup8BqEe7Mn,22,HXNhl6HD4lW,22.8.4.3,4415-HOSPITAL_22.8.4.3,SURV_HOSP_4415-The patient's physiological status is monitored during the immediate post-surgery period.,1743,FALSE,FALSE,DEFAULT,TRUE
hup8BqEe7Mn,22,pQjYj7c51Cz,22.8.5.1,4419-HOSPITAL_22.8.5.1,SURV_HOSP_4419-The assessment process makes provision for patients in pain to be identified.,1744,FALSE,FALSE,DEFAULT,TRUE
hup8BqEe7Mn,22,KSIGoxB82CX,22.8.5.2,4421-HOSPITAL_22.8.5.2,SURV_HOSP_4421-Patients in pain receive care according to pain management guidelines.,1745,FALSE,FALSE,DEFAULT,TRUE
hup8BqEe7Mn,22,v5dIKIB2pSk,22.8.5.3,4423-HOSPITAL_22.8.5.3,SURV_HOSP_4423-Patients and families are educated about pain and pain management.,1746,FALSE,FALSE,DEFAULT,TRUE
hup8BqEe7Mn,22,ruvyPLIKdtd,22.8.5.4,4425-HOSPITAL_22.8.5.4,SURV_HOSP_4425-The organisation has processes to educate health professionals in assessing and managing pain.,1747,FALSE,FALSE,DEFAULT,TRUE
hup8BqEe7Mn,22,pIUJag2FUB5,22.8.6.1,4429-HOSPITAL_22.8.6.1,SURV_HOSP_4429-Emergency blood is available at all times.,1748,FALSE,FALSE,DEFAULT,TRUE
hup8BqEe7Mn,22,kxLW6fVHIlH,22.8.6.2,4431-HOSPITAL_22.8.6.2,SURV_HOSP_4431-There is a designated refrigerator for emergency blood and blood products.,1749,FALSE,FALSE,DEFAULT,TRUE
hup8BqEe7Mn,22,j7vKGwlzAA2,22.9.1.1,4436-HOSPITAL_22.9.1.1,"SURV_HOSP_4436-Policies and procedures that guide the safe prescribing, ordering, storage, dispensing and administration of medications are implemented.",1750,FALSE,FALSE,DEFAULT,TRUE
hup8BqEe7Mn,22,anJNpZ7C9QJ,22.9.1.2,4438-HOSPITAL_22.9.1.2,SURV_HOSP_4438-Policies and procedures that guide dispensing of medications in the unit are implemented.,1751,FALSE,FALSE,DEFAULT,TRUE
hup8BqEe7Mn,22,A0QkxUQ7WiW,22.9.1.3,4440-HOSPITAL_22.9.1.3,SURV_HOSP_4440-The use of verbal/telephonic medication orders is documented.,1752,FALSE,FALSE,DEFAULT,TRUE
hup8BqEe7Mn,22,UVCRAcAXIsg,22.9.1.4,4442-HOSPITAL_22.9.1.4,SURV_HOSP_4442-Only those permitted by the organisation and by relevant laws and regulations prescribe medication.,1753,FALSE,FALSE,DEFAULT,TRUE
hup8BqEe7Mn,22,UWZ27nz6KBW,22.9.1.5,4444-HOSPITAL_22.9.1.5,"SURV_HOSP_4444-Medications, including herbal and over-the-counter medications, brought into the organisation by the patient or the family are known to the patient's medical practitioner and are noted in the patient's record.",1754,FALSE,FALSE,DEFAULT,TRUE
hup8BqEe7Mn,22,m7EdCCjuMCA,22.9.2.1,4448-HOSPITAL_22.9.2.1,SURV_HOSP_4448-Only those permitted by the organisation and by relevant laws and regulations administer medications.,1755,FALSE,FALSE,DEFAULT,TRUE
hup8BqEe7Mn,22,AkSxPxRhOaN,22.9.2.2,4450-HOSPITAL_22.9.2.2,SURV_HOSP_4450-There is evidence that patients are identified before medications are administered.,1756,FALSE,FALSE,DEFAULT,TRUE
hup8BqEe7Mn,22,DDK4ptpgBoH,22.9.2.3,4452-HOSPITAL_22.9.2.3,SURV_HOSP_4452-Medications are checked against the original prescriptions and administered as prescribed.,1757,FALSE,FALSE,DEFAULT,TRUE
hup8BqEe7Mn,22,T7kve74eXz9,22.9.2.4,4454-HOSPITAL_22.9.2.4,SURV_HOSP_4454-Health professionals monitor medication effects on patients collaboratively.,1758,FALSE,FALSE,DEFAULT,TRUE
hup8BqEe7Mn,22,rPOquPF7V5t,22.9.2.5,4456-HOSPITAL_22.9.2.5,"SURV_HOSP_4456-Adverse Drug Reactions (ADR) are observed, recorded and reported through a process and within a time frame defined by the organisation.",1759,FALSE,FALSE,DEFAULT,TRUE
hup8BqEe7Mn,22,pm5cGCiGxDX,22.9.2.6,4458-HOSPITAL_22.9.2.6,SURV_HOSP_4458-Medication errors are reported through a process and within a time frame defined by the organisation.,1760,FALSE,FALSE,DEFAULT,TRUE
hup8BqEe7Mn,22,mlZFdVrOv2J,22.9.2.7,4460-HOSPITAL_22.9.2.7,SURV_HOSP_4460-The medications prescribed for and administered to each patient are recorded.,1761,FALSE,FALSE,DEFAULT,TRUE
hup8BqEe7Mn,22,thuD0E3c9nL,22.9.3.1,4464-HOSPITAL_22.9.3.1,SURV_HOSP_4464-Medication is stored in a locked storage device or cabinet that is accessible only to authorised personnel.,1762,FALSE,FALSE,DEFAULT,TRUE
hup8BqEe7Mn,22,JPyIeoInBZd,22.9.3.2,4466-HOSPITAL_22.9.3.2,"SURV_HOSP_4466-Medications identified for special control (by law or organisational policy) are stored in a cabinet of substantial construction, for which only authorised personnel have the keys.",1763,FALSE,FALSE,DEFAULT,TRUE
hup8BqEe7Mn,22,hIw16eGPBDz,22.9.3.3,4468-HOSPITAL_22.9.3.3,SURV_HOSP_4468-Medications identified for special control (by law or organisational policy) are accurately accounted for.,1764,FALSE,FALSE,DEFAULT,TRUE
hup8BqEe7Mn,22,Cia0Z43BZvT,22.9.3.4,4470-HOSPITAL_22.9.3.4,SURV_HOSP_4470-Medications are securely and legibly labelled with relevant information as required by law and organisational policy.,1765,FALSE,FALSE,DEFAULT,TRUE
hup8BqEe7Mn,22,jLwKyDYCqBp,22.9.3.5,4472-HOSPITAL_22.9.3.5,SURV_HOSP_4472-Medications are stored in a clean environment.,1766,FALSE,FALSE,DEFAULT,TRUE
hup8BqEe7Mn,22,LHTGMbYM9jb,22.9.3.6,4474-HOSPITAL_22.9.3.6,"SURV_HOSP_4474-Medication is stored in accordance with manufacturer's instructions relating to temperature, light and humidity.",1767,FALSE,FALSE,DEFAULT,TRUE
hup8BqEe7Mn,22,UPmZmxpeast,22.9.3.7,4476-HOSPITAL_22.9.3.7,SURV_HOSP_4476-A lockable refrigerator is available for those medications requiring storage at low temperatures.,1768,FALSE,FALSE,DEFAULT,TRUE
hup8BqEe7Mn,22,kU4SFZ4bjLY,22.9.3.8,4478-HOSPITAL_22.9.3.8,SURV_HOSP_4478-The temperature of the refrigerator is monitored and recorded.,1769,FALSE,FALSE,DEFAULT,TRUE
hup8BqEe7Mn,22,mBUe37nQQ5h,22.9.3.9,4480-HOSPITAL_22.9.3.9,SURV_HOSP_4480-Expiry dates are checked (including those of emergency drugs) and drugs are replaced before expiry date.,1770,FALSE,FALSE,DEFAULT,TRUE
hup8BqEe7Mn,22,pXMQGYEGlcP,22.10.1.1,4485-HOSPITAL_22.10.1.1,SURV_HOSP_4485-Patients and families indicate that they have been informed about their diagnosis.,1771,FALSE,FALSE,DEFAULT,TRUE
hup8BqEe7Mn,22,aEm5hIBsval,22.10.1.2,4487-HOSPITAL_22.10.1.2,SURV_HOSP_4487-Patients indicate that they have been informed about the management of their condition.,1772,FALSE,FALSE,DEFAULT,TRUE
hup8BqEe7Mn,22,Y0VBp8ID7JJ,22.10.1.3,4489-HOSPITAL_22.10.1.3,"SURV_HOSP_4489-Patients are educated about their diagnosis, relevant high health risks, e.g. safe use of medication and medical equipment, medicine and food interaction, diet and food interactions, defaulting on medication use.",1773,FALSE,FALSE,DEFAULT,TRUE
hup8BqEe7Mn,22,spRXgbcVZGq,22.10.1.4,4491-HOSPITAL_22.10.1.4,SURV_HOSP_4491-Patients and families indicate that they have been informed about any financial implications of care decisions.,1774,FALSE,FALSE,DEFAULT,TRUE
hup8BqEe7Mn,22,GKayvlbuSPi,22.11.1.1,4496-HOSPITAL_22.11.1.1,SURV_HOSP_4496-Established criteria or policies that determine the appropriateness of transfers within the organisation are implemented.,1775,FALSE,FALSE,DEFAULT,TRUE
hup8BqEe7Mn,22,rxoZgk5UU3O,22.11.1.2,4498-HOSPITAL_22.11.1.2,SURV_HOSP_4498-Individuals responsible for the patient's care and its coordination are identified for all phases.,1776,FALSE,FALSE,DEFAULT,TRUE
hup8BqEe7Mn,22,iXqAN2cw7Rx,22.11.1.3,4500-HOSPITAL_22.11.1.3,SURV_HOSP_4500-Continuity and coordination are evident throughout all phases of patient care.,1777,FALSE,FALSE,DEFAULT,TRUE
hup8BqEe7Mn,22,PqGjFDSxWDY,22.11.1.4,4502-HOSPITAL_22.11.1.4,SURV_HOSP_4502-The record of the patient accompanies the patient when transferred within the organisation.,1778,FALSE,FALSE,DEFAULT,TRUE
hup8BqEe7Mn,22,jkWiRULUN88,22.11.2.1,4506-HOSPITAL_22.11.2.1,SURV_HOSP_4506-Policies and procedures that address the holding of patients for observation are implemented.,1779,FALSE,FALSE,DEFAULT,TRUE
hup8BqEe7Mn,22,bzsXbOziMwP,22.11.2.2,4508-HOSPITAL_22.11.2.2,SURV_HOSP_4508-The organisation has established appropriate time frames which limit holding time in the emergency unit.,1780,FALSE,FALSE,DEFAULT,TRUE
hup8BqEe7Mn,22,fkIppa5tRZr,22.11.2.3,4510-HOSPITAL_22.11.2.3,"SURV_HOSP_4510-Patients under observation are re-assessed at appropriate intervals to determine their response to care and treatment, and this is documented in the record.",1781,FALSE,FALSE,DEFAULT,TRUE
hup8BqEe7Mn,22,ELJSEPbyryp,22.11.2.4,4512-HOSPITAL_22.11.2.4,SURV_HOSP_4512-Any significant changes in the patient's condition are noted in the patient's record and acted upon appropriately.,1782,FALSE,FALSE,DEFAULT,TRUE
hup8BqEe7Mn,22,PHO4uJ5dXgQ,22.11.2.5,4514-HOSPITAL_22.11.2.5,SURV_HOSP_4514-Any patient care meetings or other discussions are noted in the patient's record.,1783,FALSE,FALSE,DEFAULT,TRUE
hup8BqEe7Mn,22,LmGoEUqwr4k,22.11.2.6,4516-HOSPITAL_22.11.2.6,SURV_HOSP_4516-Holding times are monitored and audited.,1784,FALSE,FALSE,DEFAULT,TRUE
hup8BqEe7Mn,22,zJFZQcKuwZk,22.11.3.1,4520-HOSPITAL_22.11.3.1,"SURV_HOSP_4520-There is a process, known to personnel, for admitting patients to the organisation.",1785,FALSE,FALSE,DEFAULT,TRUE
hup8BqEe7Mn,22,VQ9fukwLQlr,22.11.3.2,4522-HOSPITAL_22.11.3.2,SURV_HOSP_4522-The unit which accepts the patient for admission is noted in the patient record.,1786,FALSE,FALSE,DEFAULT,TRUE
hup8BqEe7Mn,22,rMT7sFauZwo,22.11.4.1,4526-HOSPITAL_22.11.4.1,SURV_HOSP_4526-Policies and procedures that guide the movement of patients for referral to another organisation are implemented.,1787,FALSE,FALSE,DEFAULT,TRUE
hup8BqEe7Mn,22,QkYIBAcAxYJ,22.11.4.2,4528-HOSPITAL_22.11.4.2,SURV_HOSP_4528-A copy of the referral note is available in the patient record.,1788,FALSE,FALSE,DEFAULT,TRUE
hup8BqEe7Mn,22,cB6p3EGS7OR,22.11.4.3,4530-HOSPITAL_22.11.4.3,SURV_HOSP_4530-Follow up care based on the findings of investigations/consultations performed outside the organisation is noted in the patient record.,1789,FALSE,FALSE,DEFAULT,TRUE
hup8BqEe7Mn,22,Bdd0LUkj90l,22.11.5.1,4534-HOSPITAL_22.11.5.1,SURV_HOSP_4534-There is a documented process for transferring patients to other organisations for specialised and support services.,1790,FALSE,FALSE,DEFAULT,TRUE
hup8BqEe7Mn,22,g6zkit1sYIm,22.11.5.2,4536-HOSPITAL_22.11.5.2,SURV_HOSP_4536-The transferring organisation determines that the receiving organisation can meet the patient's continuing care needs and establishes arrangements to ensure continuity.,1791,FALSE,FALSE,DEFAULT,TRUE
hup8BqEe7Mn,22,ngYJGXWTZl9,22.11.5.3,4538-HOSPITAL_22.11.5.3,SURV_HOSP_4538-The process for transferring the patient considers transportation needs.,1792,FALSE,FALSE,DEFAULT,TRUE
hup8BqEe7Mn,22,O3roMLTiGkz,22.11.5.4,4540-HOSPITAL_22.11.5.4,SURV_HOSP_4540-A policy that dictates that the responsible clinician communicates the level of required care to Emergency Medical (ambulance) services is implemented.,1793,FALSE,FALSE,DEFAULT,TRUE
hup8BqEe7Mn,22,hwWElALfJ3M,22.11.5.5,4542-HOSPITAL_22.11.5.5,SURV_HOSP_4542-The process determines that patients are accompanied and monitored by an appropriately qualified person during transfer.,1794,FALSE,FALSE,DEFAULT,TRUE
hup8BqEe7Mn,22,bpTX12bKrLB,22.11.5.6,4544-HOSPITAL_22.11.5.6,"SURV_HOSP_4544-When a patient is transferred to another organisation, the receiving organisation is given a written summary of the patient's clinical condition and the interventions provided by the referring organisation.",1795,FALSE,FALSE,DEFAULT,TRUE
hup8BqEe7Mn,22,nwCjqdzeqF4,22.11.5.7,4546-HOSPITAL_22.11.5.7,SURV_HOSP_4546-A copy of the transfer summary is available in the patient record.,1796,FALSE,FALSE,DEFAULT,TRUE
hup8BqEe7Mn,22,y6DxIbBuTFU,22.11.5.8,4548-HOSPITAL_22.11.5.8,SURV_HOSP_4548-The health organisation agreeing to receive the patient is noted in the patient's record.,1797,FALSE,FALSE,DEFAULT,TRUE
