programStageId,seNumber,dataElementUid,dataElementCode,dhis2DataElementCode,dhis2DataElementName,sortOrder,compulsory,allowProvidedElsewhere,renderType,active
hup8BqEe7Mn,35,Nd3cV6ut30j,35.5.1.3,6469-HOSPITAL_35.5.1.3,"SURV_HOSP_6469-Interaction between personnel, the patient and the family is noted in the patient's record.",2538,FALSE,FALSE,DEFAULT,TRUE
hup8BqEe7Mn,35,ww8Yatl5Y9D,35.6.1.1,6474-HOSPITAL_35.6.1.1,SURV_HOSP_6474-There are formalised quality improvement processes for the service that have been developed and agreed upon by the personnel of the service.,2539,FALSE,FALSE,DEFAULT,TRUE
hup8BqEe7Mn,35,RwGDhVF560A,35.6.1.2,6476-HOSPITAL_35.6.1.2,SURV_HOSP_6476-Indicators of performance are identified to evaluate the quality of treatment and patient care.,2540,FALSE,FALSE,DEFAULT,TRUE
hup8BqEe7Mn,35,XDBqWzF5qih,35.6.1.3,6478-HOSPITAL_35.6.1.3,SURV_HOSP_6478-The quality improvement cycle includes the monitoring and evaluation of the standards set and the remedial action implemented.,2541,FALSE,FALSE,DEFAULT,TRUE
hup8BqEe7Mn,35,B4jY1hpgsKw,35.6.1.4,6480-HOSPITAL_35.6.1.4,SURV_HOSP_6480-A documentation audit system is in place.,2542,FALSE,FALSE,DEFAULT,TRUE
hup8BqEe7Mn,35,rGMe9dPjYfm,35.7.1.1,6485-HOSPITAL_35.7.1.1,SURV_HOSP_6485-There are processes that support patient and family rights during care.,2543,FALSE,FALSE,DEFAULT,TRUE
hup8BqEe7Mn,35,tdsCJfSbFdP,35.7.1.2,6487-HOSPITAL_35.7.1.2,"SURV_HOSP_6487-Measures are taken to protect the patient's privacy, person and possessions.",2544,FALSE,FALSE,DEFAULT,TRUE
hup8BqEe7Mn,35,HSVYlqjC2oD,35.7.1.3,6489-HOSPITAL_35.7.1.3,SURV_HOSP_6489-The personnel respect the rights of patients and families to treatment and to refuse treatment.,2545,FALSE,FALSE,DEFAULT,TRUE
hup8BqEe7Mn,35,OmrtYncTDy8,35.8.1.1,6494-HOSPITAL_35.8.1.1,SURV_HOSP_6494-The department identifies the procedures and processes associated with the risk of infection and implements strategies to reduce risk.,2546,FALSE,FALSE,DEFAULT,TRUE
hup8BqEe7Mn,35,NhzrMytWs9R,35.8.1.2,6496-HOSPITAL_35.8.1.2,SURV_HOSP_6496-Infection control processes include prevention of the spread of communicable diseases.,2547,FALSE,FALSE,DEFAULT,TRUE
hup8BqEe7Mn,35,bRAgzPRMLLh,35.8.1.3,6498-HOSPITAL_35.8.1.3,SURV_HOSP_6498-Infection control processes include prevention of the spread of infection through testing and rehabilitation equipment.,2548,FALSE,FALSE,DEFAULT,TRUE
hup8BqEe7Mn,35,GaVjBZufHRl,35.9.1.1,6503-HOSPITAL_35.9.1.1,SURV_HOSP_6503-The department conducts on-going monitoring of risks through documented assessments as part of organisational risk management processes.,2549,FALSE,FALSE,DEFAULT,TRUE
hup8BqEe7Mn,35,i8gvf8jOe3B,35.9.1.2,6505-HOSPITAL_35.9.1.2,SURV_HOSP_6505-A system for monitoring incidents/near misses/sentinel/adverse events is available and includes the documentation of interventions and responses to recorded incidents.,2550,FALSE,FALSE,DEFAULT,TRUE
hup8BqEe7Mn,35,uZzE7f6ukgW,35.9.1.3,6507-HOSPITAL_35.9.1.3,"SURV_HOSP_6507-Security measures are in place and implemented to ensure the safety of patients, personnel and visitors.",2551,FALSE,FALSE,DEFAULT,TRUE
hup8BqEe7Mn,35,eAOlbn3ve8t,35.9.1.4,6509-HOSPITAL_35.9.1.4,SURV_HOSP_6509-Fire safety measures are implemented.,2552,FALSE,FALSE,DEFAULT,TRUE
hup8BqEe7Mn,35,LXxjv52wKuI,35.9.1.5,6511-HOSPITAL_35.9.1.5,"SURV_HOSP_6511-The organisation's policy on handling, storing and disposing of healthcare waste is implemented.",2553,FALSE,FALSE,DEFAULT,TRUE
hup8BqEe7Mn,36,uBrGO833m0X,36.1.1.1,6517-HOSPITAL_36.1.1.1,SURV_HOSP_6517-A designated individual is responsible for the clinical psychology service.,2554,FALSE,FALSE,DEFAULT,TRUE
hup8BqEe7Mn,36,ONrEtS7WPB3,36.1.1.2,6519-HOSPITAL_36.1.1.2,SURV_HOSP_6519-The clinical psychology service manager ensures that policies and procedures are available to guide the personnel and that they are implemented.,2555,FALSE,FALSE,DEFAULT,TRUE
hup8BqEe7Mn,36,qPzAU7B3xNL,36.1.1.3,6521-HOSPITAL_36.1.1.3,SURV_HOSP_6521-The manager plans and implements an effective organisational structure to support his/her responsibilities and authority.,2556,FALSE,FALSE,DEFAULT,TRUE
hup8BqEe7Mn,36,Ymz1WNK1COx,36.1.1.4,6523-HOSPITAL_36.1.1.4,SURV_HOSP_6523-The responsibilities of the manager are defined in writing.,2557,FALSE,FALSE,DEFAULT,TRUE
hup8BqEe7Mn,36,ZSWB5mWumRi,36.1.1.5,6525-HOSPITAL_36.1.1.5,SURV_HOSP_6525-The manager ensures that there is a documented wellness programme in place for the staff within the department.,2558,FALSE,FALSE,DEFAULT,TRUE
hup8BqEe7Mn,36,BtrODKk7tNN,36.2.1.1,6530-HOSPITAL_36.2.1.1,SURV_HOSP_6530-There is adequate space for clinical psychologists to treat patients effectively.,2559,FALSE,FALSE,DEFAULT,TRUE
hup8BqEe7Mn,36,wEVAjlpwjc3,36.2.1.2,6532-HOSPITAL_36.2.1.2,SURV_HOSP_6532-Adequate and relevant equipment and consumables are available to provide an effective service.,2560,FALSE,FALSE,DEFAULT,TRUE
hup8BqEe7Mn,36,D4Hw3zflMZx,36.2.1.3,6534-HOSPITAL_36.2.1.3,SURV_HOSP_6534-There is adequate space for the storage of equipment and consumables.,2561,FALSE,FALSE,DEFAULT,TRUE
hup8BqEe7Mn,36,BZCLPieBx9Y,36.2.1.4,6536-HOSPITAL_36.2.1.4,"SURV_HOSP_6536-Privacy is ensured through private cubicles, curtains or screens.",2562,FALSE,FALSE,DEFAULT,TRUE
hup8BqEe7Mn,36,CRxWzUYcgiI,36.3.1.1,6541-HOSPITAL_36.3.1.1,SURV_HOSP_6541-Policies and procedures that guide the personnel in the management and clinical aspects of the clinical psychology service are implemented.,2563,FALSE,FALSE,DEFAULT,TRUE
hup8BqEe7Mn,36,VGGesNQNnzh,36.3.1.2,6543-HOSPITAL_36.3.1.2,SURV_HOSP_6543-Policies and procedures are signed by persons authorised to do so.,2564,FALSE,FALSE,DEFAULT,TRUE
hup8BqEe7Mn,36,E5Om7M95qSe,36.3.1.3,6545-HOSPITAL_36.3.1.3,"SURV_HOSP_6545-Policies and procedures are compiled into a comprehensive manual, which is indexed and easily accessible to all staff members.",2565,FALSE,FALSE,DEFAULT,TRUE
hup8BqEe7Mn,36,UcDxG18H61t,36.3.1.4,6547-HOSPITAL_36.3.1.4,SURV_HOSP_6547-Each policy and procedure is reviewed as per organisational requirement.,2566,FALSE,FALSE,DEFAULT,TRUE
hup8BqEe7Mn,36,YimV7TvUKYv,36.4.1.1,6552-HOSPITAL_36.4.1.1,SURV_HOSP_6552-There is a multidisciplinary/interdisciplinary approach to the development and implementation of a therapeutic programme.,2567,FALSE,FALSE,DEFAULT,TRUE
hup8BqEe7Mn,36,x81TJQlsR6m,36.4.1.2,6554-HOSPITAL_36.4.1.2,"SURV_HOSP_6554-The team consists of appropriately qualified personnel, including representatives from the medical, nursing, social work, occupational therapy, clinical psychology and other disciplines, departments or services, as ",2568,FALSE,FALSE,DEFAULT,TRUE
hup8BqEe7Mn,36,C8P6tmsBuBM,36.4.1.3,6556-HOSPITAL_36.4.1.3,"SURV_HOSP_6556-The team members' responsibilities include the development and implementation of a comprehensive, individualised care plan for each patient, based on the assessment of the patient.",2569,FALSE,FALSE,DEFAULT,TRUE
hup8BqEe7Mn,36,Z0Uf82ifLmI,36.4.1.4,6558-HOSPITAL_36.4.1.4,SURV_HOSP_6558-The team conducts periodic re-evaluation of each patient's care plan to determine whether established goals are being or have been met and whether change in the patient's condition requires modification of goals.,2570,FALSE,FALSE,DEFAULT,TRUE
hup8BqEe7Mn,36,jIl8e1hGtng,36.4.1.5,6560-HOSPITAL_36.4.1.5,"SURV_HOSP_6560-The team includes the patient and his/her family in the development and review of the care plan, as appropriate.",2571,FALSE,FALSE,DEFAULT,TRUE
hup8BqEe7Mn,36,BhslhljbtXC,36.4.2.1,6564-HOSPITAL_36.4.2.1,SURV_HOSP_6564-Only those individuals permitted by applicable laws and regulations or by registration perform the assessments.,2572,FALSE,FALSE,DEFAULT,TRUE
hup8BqEe7Mn,36,qiNcgiMWlf2,36.4.2.2,6566-HOSPITAL_36.4.2.2,SURV_HOSP_6566-The findings of assessments performed outside the organisation are verified on admission.,2573,FALSE,FALSE,DEFAULT,TRUE
hup8BqEe7Mn,36,f0S8EX71FeI,36.4.2.3,6568-HOSPITAL_36.4.2.3,"SURV_HOSP_6568-Patients are re-assessed at intervals appropriate to their conditions, care plans, individual needs or according to organisational policies and procedures.",2574,FALSE,FALSE,DEFAULT,TRUE
hup8BqEe7Mn,36,O0b95ybEEay,36.4.3.1,6572-HOSPITAL_36.4.3.1,SURV_HOSP_6572-Clinical practice guidelines relevant to the patients and services of the organisation are used to guide patient care processes.,2575,FALSE,FALSE,DEFAULT,TRUE
hup8BqEe7Mn,36,lW5C75WpBD3,36.4.3.2,6574-HOSPITAL_36.4.3.2,SURV_HOSP_6574-The implementation of guidelines is monitored as part of a structured clinical audit.,2576,FALSE,FALSE,DEFAULT,TRUE
hup8BqEe7Mn,36,EoKzK6NMZI3,36.4.3.3,6576-HOSPITAL_36.4.3.3,SURV_HOSP_6576-Guidelines are reviewed and adapted on a regular basis.,2577,FALSE,FALSE,DEFAULT,TRUE
hup8BqEe7Mn,36,QE5YrQRkJNu,36.5.1.1,6581-HOSPITAL_36.5.1.1,SURV_HOSP_6581-Patients and families indicate that they have been informed about participation in the care process.,2578,FALSE,FALSE,DEFAULT,TRUE
hup8BqEe7Mn,36,erDqgtsnymo,36.5.1.2,6583-HOSPITAL_36.5.1.2,SURV_HOSP_6583-Patients and families indicate that they have been informed about any financial implications of care decisions.,2579,FALSE,FALSE,DEFAULT,TRUE
hup8BqEe7Mn,36,DME85sK8IHk,36.5.1.3,6585-HOSPITAL_36.5.1.3,"SURV_HOSP_6585-Interaction between personnel, the patient and the family is noted in the patient's record.",2580,FALSE,FALSE,DEFAULT,TRUE
hup8BqEe7Mn,36,Kgd9RXomCiF,36.6.1.1,6590-HOSPITAL_36.6.1.1,SURV_HOSP_6590-There are formalised quality improvement processes for the service that have been developed and agreed upon by the personnel of the service.,2581,FALSE,FALSE,DEFAULT,TRUE
hup8BqEe7Mn,36,qOLIl4yWxdR,36.6.1.2,6592-HOSPITAL_36.6.1.2,SURV_HOSP_6592-Indicators of performance are identified to evaluate the quality of treatment and patient care.,2582,FALSE,FALSE,DEFAULT,TRUE
hup8BqEe7Mn,36,CJOY2F1xXXg,36.6.1.3,6594-HOSPITAL_36.6.1.3,SURV_HOSP_6594-The quality improvement cycle includes the monitoring and evaluation of the standards set and the remedial action implemented.,2583,FALSE,FALSE,DEFAULT,TRUE
hup8BqEe7Mn,36,GC2zBuA9juz,36.6.1.4,6596-HOSPITAL_36.6.1.4,SURV_HOSP_6596-A documentation audit system is in place.,2584,FALSE,FALSE,DEFAULT,TRUE
hup8BqEe7Mn,36,XKLJSXcfZLm,36.7.1.1,6601-HOSPITAL_36.7.1.1,SURV_HOSP_6601-There are processes that support patient and family rights during care.,2585,FALSE,FALSE,DEFAULT,TRUE
hup8BqEe7Mn,36,i14Pr9Jzkzk,36.7.1.2,6603-HOSPITAL_36.7.1.2,"SURV_HOSP_6603-Measures are taken to protect the patient's privacy, person and possessions.",2586,FALSE,FALSE,DEFAULT,TRUE
hup8BqEe7Mn,36,bEKLODAF7tp,36.7.1.3,6605-HOSPITAL_36.7.1.3,SURV_HOSP_6605-The personnel respect the rights of patients and families to treatment and to refuse treatment.,2587,FALSE,FALSE,DEFAULT,TRUE
hup8BqEe7Mn,36,yjeMVEyYSk2,36.8.1.1,6610-HOSPITAL_36.8.1.1,SURV_HOSP_6610-The department identifies the procedures and processes associated with the risk of infection and implements strategies to reduce risk.,2588,FALSE,FALSE,DEFAULT,TRUE
hup8BqEe7Mn,36,KwAtsQR3B3D,36.8.1.2,6612-HOSPITAL_36.8.1.2,SURV_HOSP_6612-Infection control processes includes prevention of the spread of infection related to testing and rehabilitation equipment.,2589,FALSE,FALSE,DEFAULT,TRUE
hup8BqEe7Mn,36,dqU8arU0fBO,36.9.1.1,6617-HOSPITAL_36.9.1.1,SURV_HOSP_6617-The department conducts ongoing monitoring of risks through documented assessments as part of the organisational risk management processes.,2590,FALSE,FALSE,DEFAULT,TRUE
hup8BqEe7Mn,36,IZuajiplSLv,36.9.1.2,6619-HOSPITAL_36.9.1.2,SURV_HOSP_6619-A system for monitoring incidents/near misses/sentinel/adverse events is available and includes the documentation of interventions and responses to recorded incidents.,2591,FALSE,FALSE,DEFAULT,TRUE
hup8BqEe7Mn,36,xHiHHMxVqXQ,36.9.1.3,6621-HOSPITAL_36.9.1.3,"SURV_HOSP_6621-Security measures are in place and implemented to ensure the safety of patients, staff and visitors.",2592,FALSE,FALSE,DEFAULT,TRUE
hup8BqEe7Mn,36,c0tns6MYyQJ,36.9.1.4,6623-HOSPITAL_36.9.1.4,SURV_HOSP_6623-Fire safety measures are implemented.,2593,FALSE,FALSE,DEFAULT,TRUE
hup8BqEe7Mn,36,Toj1Jz9L0Ia,36.9.1.5,6625-HOSPITAL_36.9.1.5,"SURV_HOSP_6625-The organisation's policy on handling, storing and disposing of healthcare waste is implemented.",2594,FALSE,FALSE,DEFAULT,TRUE
hup8BqEe7Mn,37,Hn7aijhD7kK,37.1.1.1,6631-HOSPITAL_37.1.1.1,SURV_HOSP_6631-A designated individual is responsible for the social work service.,2595,FALSE,FALSE,DEFAULT,TRUE
hup8BqEe7Mn,37,ZMbT1fCXvDL,37.1.1.2,6633-HOSPITAL_37.1.1.2,SURV_HOSP_6633-The social work service manager ensures that policies and procedures are available to guide the personnel and that they are implemented.,2596,FALSE,FALSE,DEFAULT,TRUE
hup8BqEe7Mn,37,cE2Gu8LsucZ,37.1.1.3,6635-HOSPITAL_37.1.1.3,SURV_HOSP_6635-The manager plans and implements an effective organisational structure to support his/her responsibilities and authority.,2597,FALSE,FALSE,DEFAULT,TRUE
hup8BqEe7Mn,37,EY5XrGifP6T,37.1.1.4,6637-HOSPITAL_37.1.1.4,SURV_HOSP_6637-The responsibilities of the manager are defined in writing.,2598,FALSE,FALSE,DEFAULT,TRUE
hup8BqEe7Mn,37,Bv5Ur3RxCAW,37.1.1.5,6639-HOSPITAL_37.1.1.5,SURV_HOSP_6639-The manager ensures that there is a documented wellness programme in place for the staff within the department.,2599,FALSE,FALSE,DEFAULT,TRUE
hup8BqEe7Mn,37,yGYwlmzkJEe,37.2.1.1,6644-HOSPITAL_37.2.1.1,SURV_HOSP_6644-There is adequate space for social workers to treat patients effectively.,2600,FALSE,FALSE,DEFAULT,TRUE
hup8BqEe7Mn,37,c7Yk3kz8knC,37.2.1.2,6646-HOSPITAL_37.2.1.2,SURV_HOSP_6646-Adequate and relevant equipment and consumables are available to provide an effective service.,2601,FALSE,FALSE,DEFAULT,TRUE
hup8BqEe7Mn,37,nlti94se8hr,37.2.1.3,6648-HOSPITAL_37.2.1.3,SURV_HOSP_6648-There is adequate space for the storage of equipment and consumables.,2602,FALSE,FALSE,DEFAULT,TRUE
hup8BqEe7Mn,37,GbmTZVxeXrG,37.2.1.4,6650-HOSPITAL_37.2.1.4,"SURV_HOSP_6650-Privacy is ensured through private, soundproof rooms.",2603,FALSE,FALSE,DEFAULT,TRUE
hup8BqEe7Mn,37,NzSebsroRSY,37.3.1.1,6655-HOSPITAL_37.3.1.1,SURV_HOSP_6655-Policies and procedures that guide the personnel in the management and clinical aspects of the social work service are implemented.,2604,FALSE,FALSE,DEFAULT,TRUE
hup8BqEe7Mn,37,JVqZONEbdKm,37.3.1.2,6657-HOSPITAL_37.3.1.2,SURV_HOSP_6657-Policies and procedures are signed by persons authorised to do so.,2605,FALSE,FALSE,DEFAULT,TRUE
hup8BqEe7Mn,37,ferGPwCzkTM,37.3.1.3,6659-HOSPITAL_37.3.1.3,"SURV_HOSP_6659-Policies and procedures are compiled into a comprehensive manual, which is indexed and easily accessible to all staff members.",2606,FALSE,FALSE,DEFAULT,TRUE
hup8BqEe7Mn,37,A7GkhPVv1ho,37.3.1.4,6661-HOSPITAL_37.3.1.4,SURV_HOSP_6661-Each policy and procedure is reviewed.,2607,FALSE,FALSE,DEFAULT,TRUE
hup8BqEe7Mn,37,CHjiGKO1nrV,37.4.1.1,6666-HOSPITAL_37.4.1.1,SURV_HOSP_6666-There is a multidisciplinary/interdisciplinary approach to the development and implementation of a therapeutic programme.,2608,FALSE,FALSE,DEFAULT,TRUE
hup8BqEe7Mn,37,EUVwfalTsA9,37.4.1.2,6668-HOSPITAL_37.4.1.2,"SURV_HOSP_6668-The team consists of appropriately qualified personnel, including representatives from the medical, nursing, social work, physiotherapy, occupational therapy, clinical psychology and other disciplines, departments o",2609,FALSE,FALSE,DEFAULT,TRUE
hup8BqEe7Mn,37,egNRCMhSK4V,37.4.1.3,6670-HOSPITAL_37.4.1.3,"SURV_HOSP_6670-The team members' responsibilities include the development and implementation of a comprehensive, individualised care plan for each patient, based on the assessment of the patient.",2610,FALSE,FALSE,DEFAULT,TRUE
hup8BqEe7Mn,37,E1s4oOuDI0j,37.4.1.4,6672-HOSPITAL_37.4.1.4,SURV_HOSP_6672-The team conducts periodic re-evaluation of each patient's care plan to determine whether established goals are being or have been met and whether change in the patient's condition requires modification of goals.,2611,FALSE,FALSE,DEFAULT,TRUE
hup8BqEe7Mn,37,yQ6ezsStQHY,37.4.1.5,6674-HOSPITAL_37.4.1.5,"SURV_HOSP_6674-The team includes the patient and his/her family in the development and review of the care plan, as appropriate.",2612,FALSE,FALSE,DEFAULT,TRUE
hup8BqEe7Mn,37,kLT1g7ooxm7,37.4.1.6,6676-HOSPITAL_37.4.1.6,SURV_HOSP_6676-The multidisciplinary/interdisciplinary team meets regularly to coordinate patient care.,2613,FALSE,FALSE,DEFAULT,TRUE
hup8BqEe7Mn,37,X9KNlUbRUuM,37.4.2.1,6680-HOSPITAL_37.4.2.1,SURV_HOSP_6680-Only those individuals permitted by applicable laws and regulations or by registration perform the assessments.,2614,FALSE,FALSE,DEFAULT,TRUE
hup8BqEe7Mn,37,QjQ5Mw2PeAk,37.4.2.2,6682-HOSPITAL_37.4.2.2,SURV_HOSP_6682-The findings of assessments performed outside the organisation are verified on admission.,2615,FALSE,FALSE,DEFAULT,TRUE
hup8BqEe7Mn,37,nKtgzTue7dj,37.4.2.3,6684-HOSPITAL_37.4.2.3,"SURV_HOSP_6684-Patients are re-assessed at intervals appropriate to their conditions, care plans, individual needs or according to organisational policies and procedures.",2616,FALSE,FALSE,DEFAULT,TRUE
hup8BqEe7Mn,37,wQNmWT1YNrW,37.4.3.1,6688-HOSPITAL_37.4.3.1,"SURV_HOSP_6688-Clinical practice guidelines, relevant to the patients and services of the organisation, are used to guide patient care processes.",2617,FALSE,FALSE,DEFAULT,TRUE
hup8BqEe7Mn,37,aWiURxgWuvm,37.4.3.2,6690-HOSPITAL_37.4.3.2,SURV_HOSP_6690-The implementation of guidelines is monitored as part of a structured clinical audit.,2618,FALSE,FALSE,DEFAULT,TRUE
hup8BqEe7Mn,37,Wf33LBUxEt9,37.4.3.3,6692-HOSPITAL_37.4.3.3,SURV_HOSP_6692-Guidelines are reviewed and adapted on a regular basis after implementation.,2619,FALSE,FALSE,DEFAULT,TRUE
hup8BqEe7Mn,37,xpG0Q3gX2rS,37.5.1.1,6697-HOSPITAL_37.5.1.1,SURV_HOSP_6697-Patients and families indicate that they have been informed about participation in the care process.,2620,FALSE,FALSE,DEFAULT,TRUE
hup8BqEe7Mn,37,whEBoZ9pXip,37.5.1.2,6699-HOSPITAL_37.5.1.2,SURV_HOSP_6699-Patients and families indicate that they have been informed about any financial implications of care decisions.,2621,FALSE,FALSE,DEFAULT,TRUE
hup8BqEe7Mn,37,XU62XmjXBYU,37.5.1.3,6701-HOSPITAL_37.5.1.3,"SURV_HOSP_6701-Interaction between personnel, the patient and the family is noted in the patient's record.",2622,FALSE,FALSE,DEFAULT,TRUE
hup8BqEe7Mn,37,GxcCLxnCU7L,37.6.1.1,6706-HOSPITAL_37.6.1.1,SURV_HOSP_6706-There are formalised quality improvement processes for the service that have been developed and agreed upon by the personnel of the service.,2623,FALSE,FALSE,DEFAULT,TRUE
hup8BqEe7Mn,37,SNNwXjhCGWH,37.6.1.2,6708-HOSPITAL_37.6.1.2,SURV_HOSP_6708-Indicators of performance are identified to evaluate the quality of treatment and patient care.,2624,FALSE,FALSE,DEFAULT,TRUE
hup8BqEe7Mn,37,RVrrZE2SFMH,37.6.1.3,6710-HOSPITAL_37.6.1.3,SURV_HOSP_6710-The quality improvement cycle includes the monitoring and evaluation of the standards set and the remedial action implemented.,2625,FALSE,FALSE,DEFAULT,TRUE
hup8BqEe7Mn,37,aRSLn5fcS14,37.6.1.4,6712-HOSPITAL_37.6.1.4,SURV_HOSP_6712-A documentation audit system is in place.,2626,FALSE,FALSE,DEFAULT,TRUE
hup8BqEe7Mn,37,LiUz4U3MrOM,37.7.1.1,6717-HOSPITAL_37.7.1.1,SURV_HOSP_6717-There are processes that support patient and family rights during care.,2627,FALSE,FALSE,DEFAULT,TRUE
hup8BqEe7Mn,37,X4dwydDzNUV,37.7.1.2,6719-HOSPITAL_37.7.1.2,"SURV_HOSP_6719-Measures are taken to protect the patient's privacy, person and possessions.",2628,FALSE,FALSE,DEFAULT,TRUE
hup8BqEe7Mn,37,ku8CYn5N9Jv,37.7.1.3,6721-HOSPITAL_37.7.1.3,SURV_HOSP_6721-The personnel respect the rights of patients and families to treatment and to refuse treatment.,2629,FALSE,FALSE,DEFAULT,TRUE
hup8BqEe7Mn,37,otmcMFI6vcD,37.8.1.1,6726-HOSPITAL_37.8.1.1,SURV_HOSP_6726-The department identifies the procedures and processes associated with the risk of infection and implements strategies to reduce risk.,2630,FALSE,FALSE,DEFAULT,TRUE
hup8BqEe7Mn,37,yxsJLjM5NcJ,37.8.1.2,6728-HOSPITAL_37.8.1.2,SURV_HOSP_6728-Infection control processes include prevention of the spread of communicable diseases.,2631,FALSE,FALSE,DEFAULT,TRUE
hup8BqEe7Mn,37,XNc5dQTNmDb,37.8.1.3,6730-HOSPITAL_37.8.1.3,SURV_HOSP_6730-Infection control processes include prevention of the spread of infection related to equipment.,2632,FALSE,FALSE,DEFAULT,TRUE
hup8BqEe7Mn,37,XmjECbflWhF,37.9.1.1,6735-HOSPITAL_37.9.1.1,SURV_HOSP_6735-Fire safety measures are implemented.,2633,FALSE,FALSE,DEFAULT,TRUE
hup8BqEe7Mn,37,LDo7il8bCG4,37.9.1.2,6737-HOSPITAL_37.9.1.2,"SURV_HOSP_6737-The organisation's policy on handling, storing and disposing of healthcare waste is implemented.",2634,FALSE,FALSE,DEFAULT,TRUE
hup8BqEe7Mn,38,Vxz2db2Sjo5,38.1.1.1,6743-HOSPITAL_38.1.1.1,SURV_HOSP_6743-A designated individual is responsible for the audiology service.,2635,FALSE,FALSE,DEFAULT,TRUE
hup8BqEe7Mn,38,HCo8dY0lbMQ,38.1.1.2,6745-HOSPITAL_38.1.1.2,SURV_HOSP_6745-The audiology service manager ensures that policies and procedures are available to guide the personnel and that they are implemented.,2636,FALSE,FALSE,DEFAULT,TRUE
hup8BqEe7Mn,38,dujlNDTw7Ps,38.1.1.3,6747-HOSPITAL_38.1.1.3,SURV_HOSP_6747-The manager plans and implements an effective organisational structure to support his/her responsibilities and authority.,2637,FALSE,FALSE,DEFAULT,TRUE
hup8BqEe7Mn,38,yFysmgvyzdK,38.1.1.4,6749-HOSPITAL_38.1.1.4,SURV_HOSP_6749-The responsibilities of the manager are defined in writing.,2638,FALSE,FALSE,DEFAULT,TRUE
hup8BqEe7Mn,38,SsABKdoHwya,38.1.1.5,6751-HOSPITAL_38.1.1.5,SURV_HOSP_6751-The manager ensures that there is a documented wellness programme in place for staff within the department.,2639,FALSE,FALSE,DEFAULT,TRUE
hup8BqEe7Mn,38,mjoHQHN9SEk,38.2.1.1,6756-HOSPITAL_38.2.1.1,SURV_HOSP_6756-There is adequate space for audiologists to treat patients effectively.,2640,FALSE,FALSE,DEFAULT,TRUE
hup8BqEe7Mn,38,RgJX4OfGBQq,38.2.1.2,6758-HOSPITAL_38.2.1.2,SURV_HOSP_6758-Adequate and relevant equipment and consumables are available to provide an effective service.,2641,FALSE,FALSE,DEFAULT,TRUE
hup8BqEe7Mn,38,opHOIxxjkuK,38.2.1.3,6760-HOSPITAL_38.2.1.3,SURV_HOSP_6760-There is adequate space for the storage of equipment and consumables.,2642,FALSE,FALSE,DEFAULT,TRUE
hup8BqEe7Mn,38,Vxr4IG4MLuh,38.2.1.4,6762-HOSPITAL_38.2.1.4,"SURV_HOSP_6762-Privacy is ensured through private cubicles, curtains or screens.",2643,FALSE,FALSE,DEFAULT,TRUE
hup8BqEe7Mn,38,KI0o0PitvQT,38.3.1.1,6767-HOSPITAL_38.3.1.1,SURV_HOSP_6767-Policies and procedures that guide the personnel in the management and clinical aspects of the audiology service are implemented.,2644,FALSE,FALSE,DEFAULT,TRUE
hup8BqEe7Mn,38,H8Bb3BKFov3,38.3.1.2,6769-HOSPITAL_38.3.1.2,SURV_HOSP_6769-Policies and procedures are signed by persons authorised to do so.,2645,FALSE,FALSE,DEFAULT,TRUE
hup8BqEe7Mn,38,kcBLbShaHm2,38.3.1.3,6771-HOSPITAL_38.3.1.3,"SURV_HOSP_6771-Policies and procedures are compiled into a comprehensive manual, which is indexed and easily accessible to all personnel members.",2646,FALSE,FALSE,DEFAULT,TRUE
hup8BqEe7Mn,38,lNnRZfWXSvD,38.3.1.4,6773-HOSPITAL_38.3.1.4,SURV_HOSP_6773-Each policy and procedure is reviewed.,2647,FALSE,FALSE,DEFAULT,TRUE
hup8BqEe7Mn,38,DsfsOOJAjY6,38.4.1.1,6778-HOSPITAL_38.4.1.1,SURV_HOSP_6778-There is a multidisciplinary/interdisciplinary approach to the development and implementation of a therapeutic programme.,2648,FALSE,FALSE,DEFAULT,TRUE
hup8BqEe7Mn,38,gf8aeTkpcTE,38.4.1.2,6780-HOSPITAL_38.4.1.2,"SURV_HOSP_6780-The team consists of appropriately qualified personnel, including representatives from the medical, nursing, social work, physiotherapy, audiology, occupational therapy, clinical psychology and other disciplines, de",2649,FALSE,FALSE,DEFAULT,TRUE
hup8BqEe7Mn,38,rm5SiBaHGzH,38.4.1.3,6782-HOSPITAL_38.4.1.3,"SURV_HOSP_6782-The team members' responsibilities include the development and implementation of a comprehensive, individualised care plan for each patient, based on the assessment of the patient.",2650,FALSE,FALSE,DEFAULT,TRUE
hup8BqEe7Mn,38,hOeRH3OQ22Q,38.4.1.4,6784-HOSPITAL_38.4.1.4,SURV_HOSP_6784-The team conducts periodic re-evaluation of each patient's care plan to determine whether established goals are being or have been met and whether change in the patient's condition requires modification of goals.,2651,FALSE,FALSE,DEFAULT,TRUE
hup8BqEe7Mn,38,wrZ6HJtApRc,38.4.1.5,6786-HOSPITAL_38.4.1.5,"SURV_HOSP_6786-The team includes the patient and his/her family in the development and review of the care plan, as appropriate.",2652,FALSE,FALSE,DEFAULT,TRUE
hup8BqEe7Mn,38,XMipnto4B9d,38.4.1.6,6788-HOSPITAL_38.4.1.6,SURV_HOSP_6788-The multidisciplinary/interdisciplinary team meets regularly to co-ordinate patient care.,2653,FALSE,FALSE,DEFAULT,TRUE
hup8BqEe7Mn,38,vWqN7D5kgrC,38.4.2.1,6792-HOSPITAL_38.4.2.1,SURV_HOSP_6792-Only those individuals permitted by applicable laws and regulations or by registration perform the assessments.,2654,FALSE,FALSE,DEFAULT,TRUE
hup8BqEe7Mn,38,SPSzLb2qMyp,38.4.2.2,6794-HOSPITAL_38.4.2.2,SURV_HOSP_6794-The findings of assessments performed outside the organisation are verified on admission.,2655,FALSE,FALSE,DEFAULT,TRUE
hup8BqEe7Mn,38,bgQMpdNbepA,38.4.2.3,6796-HOSPITAL_38.4.2.3,"SURV_HOSP_6796-Patients are re-assessed at intervals appropriate to their conditions, care plans, individual needs or according to organisational policies and procedures.",2656,FALSE,FALSE,DEFAULT,TRUE
hup8BqEe7Mn,38,JHqQCqBnyx2,38.4.3.1,6800-HOSPITAL_38.4.3.1,"SURV_HOSP_6800-Clinical practice guidelines, relevant to the patients and services of the organisation, are used to guide patient care processes.",2657,FALSE,FALSE,DEFAULT,TRUE
hup8BqEe7Mn,38,ZVJ7cqTfdIw,38.4.3.2,6802-HOSPITAL_38.4.3.2,SURV_HOSP_6802-The implementation of guidelines is monitored as part of a structured clinical audit.,2658,FALSE,FALSE,DEFAULT,TRUE
hup8BqEe7Mn,38,JOdZLEHH0st,38.4.3.3,6804-HOSPITAL_38.4.3.3,SURV_HOSP_6804-Guidelines are reviewed and adapted on a regular basis.,2659,FALSE,FALSE,DEFAULT,TRUE
